"updated_label","original_url","old_label","source_article","explanations","rationale"
"[MSK1] is claiming [MSK2]. [MSK1] is a moron. Therefore, [MSK2] is not true.","https://quizizz.com/admin/quiz/5f866cd09b8715001bf9a88c/identify-logical-fallacies","ad hominem","“We shouldn’t even bother to interview that job applicant. He has a beard.”","",""
"[MSK1] is claiming [MSK2]. [MSK1] is a moron. Therefore, [MSK2] is not true.","https://quizizz.com/admin/quiz/5af3432e02fd7c0019e40cd2/king-hamilton-logical-fallacies","ad hominem","A mother who tells the pediatrician that she doesn't trust his judgment because he's never been a mother.","",""
"[MSK1] is claiming [MSK2]. [MSK1] is a moron. Therefore, [MSK2] is not true.","https://quizizz.com/admin/quiz/5c890a34b355a3001d6addb9/logical-fallacies","ad hominem","Congressman Darell Issa calls White House Spokesperson Jay Carney a ""paid liar.""","",""
"[MSK1] is claiming [MSK2]. [MSK1] is a moron. Therefore, [MSK2] is not true.","https://quizizz.com/admin/quiz/5df92b0aa5d605001fad432c/logical-fallacies-presidential-speeches","ad hominem","BILL CLINTON: But when Joe McCarthy went around this country attacking people’s patriotism, he was wrong. He was wrong. And a senator from Connecticut stood up to him named Prescott Bush. Your father was right to stand up to Joe McCarthy, you were wrong to attack my patriotism. I was opposed to the war but I loved my country… Debate 1, October 11, 1992 St. Louis, Missouri","",""
"[MSK1] is claiming [MSK2]. [MSK1] is a moron. Therefore, [MSK2] is not true.","https://quizizz.com/admin/quiz/5c6cbd74936b92001a45521b/logical-fallacies","ad hominem","I can't understand how such a low performance student is able to talk about politics","",""
"[MSK1] is claiming [MSK2]. [MSK1] is a moron. Therefore, [MSK2] is not true.","https://quizizz.com/admin/quiz/606f1a28b1113a001b6d6ba2/logical-fallicies","ad hominem","Thanks to her enduring popularity with employees, Annie Smith is the best-liked CEO in our company's history.","",""
"[MSK1] is claiming [MSK2]. [MSK1] is a moron. Therefore, [MSK2] is not true.","https://quizizz.com/admin/quiz/6059f970a5d7c3001da9d533/logical-fallacies","ad hominem","Before I refute my opponent's argument, I would like to draw attention to the fact that he is sweating and clearly does not have much experience on the debate team.","",""
"[MSK1] is claiming [MSK2]. [MSK1] is a moron. Therefore, [MSK2] is not true.","https://quizizz.com/admin/quiz/60241e5e579e66001c40dfbd/logical-fallacies","ad hominem","""You haven't held a steady job since 1992. Worse than that, we couldn't find a single employer who'd provide you with a good reference.""","",""
"[MSK1] is claiming [MSK2]. [MSK1] is a moron. Therefore, [MSK2] is not true.","https://quizizz.com/admin/quiz/5e263688c11931001b7ac19a/logical-fallacies","ad hominem","A Congressman calls a Whitehouse Spokesperson a ""giant idiot""","",""
"[MSK1] is claiming [MSK2]. [MSK1] is a moron. Therefore, [MSK2] is not true.","https://quizizz.com/admin/quiz/5e263688c11931001b7ac19a/logical-fallacies","ad hominem","Don't listen to her even though she's a doctor. She isn't a good person, so her opinion is invalid.","",""
"[MSK1] is claiming [MSK2]. [MSK1] is a moron. Therefore, [MSK2] is not true.","https://quizizz.com/admin/quiz/5a0f0600920b9b1100fb5669/logical-fallacy","ad hominem","Billy - ""An apple is a vegetable.""  Bobby - ""Don't listen to Billy; he failed Spanish class last year. ""","",""
"[MSK1] is claiming [MSK2]. [MSK1] is a moron. Therefore, [MSK2] is not true.","https://quizizz.com/admin/quiz/5fa59387abc53e001b67ecbc/logical-fallacies","ad hominem","That candidate wants to raise the minimum wage, but they aren't even smart enough to run a business.","",""
"[MSK1] is claiming [MSK2]. [MSK1] is a moron. Therefore, [MSK2] is not true.","https://quizizz.com/admin/quiz/5fa59387abc53e001b67ecbc/logical-fallacies","ad hominem","Mrs. Peters is nominated for teacher of the year, which is voted on by her fellow faculty members. A colleague says that she would never vote for her because she is too young.","",""
"[MSK1] is claiming [MSK2]. [MSK1] is a moron. Therefore, [MSK2] is not true.","https://quizizz.com/admin/quiz/5fa59387abc53e001b67ecbc/logical-fallacies","ad hominem","Marco cusses a lot, so you can't listen to a thing he says. He's not a good guy.","",""
"[MSK1] is claiming [MSK2]. [MSK1] is a moron. Therefore, [MSK2] is not true.","https://quizizz.com/admin/quiz/5af3432e02fd7c0019e40cd2/king-hamilton-logical-fallacies","ad hominem","A parent who says that the teacher doesn't know how to teach because she graduated from a community college.","",""
"[MSK1] is claiming [MSK2]. [MSK1] is a moron. Therefore, [MSK2] is not true.","https://quizizz.com/admin/quiz/606629c9f6277b001bfe66ab/logical-fallacies","ad hominem","Oh please, what do you know about labor laws? You don't even have a job.","",""
"[MSK1] is claiming [MSK2]. [MSK1] is a moron. Therefore, [MSK2] is not true.","https://quizizz.com/admin/quiz/5fa5924f4bc06f001bf18f58/logical-fallacy-quiz-swhs","ad hominem","In his class president election video, he called his student opponent 'a brown-nosing, suck up who only wanted to get on the teacher's good side,' which got him disqualified","",""
"[MSK1] is claiming [MSK2]. [MSK1] is a moron. Therefore, [MSK2] is not true.","https://quizizz.com/admin/quiz/5a299094876fa01100a5d10b/logical-fallacy-review","ad hominem","He can't be a great athlete; he didn't adopt the stray dog on the street.","",""
"[MSK1] is claiming [MSK2]. [MSK1] is a moron. Therefore, [MSK2] is not true.","https://quizizz.com/admin/quiz/5b2b2aa736a5270019a279ba/fallacy-quiz-part","ad hominem","""In the business meeting, she proposed a new advertising plan for the dog food brand, but I found out she actually hates dogs. How can we trust her advertising skills?""","",""
"[MSK1] is claiming [MSK2]. [MSK1] is a moron. Therefore, [MSK2] is not true.","https://quizizz.com/admin/quiz/5e664486989dc2001edc9ad5/logical-fallacies","tu quoque","Billy - ""Spanish is easy."" Bobby - ""Don't listen to Billy; he failed Spanish class last year. ""","",""
"[MSK1] is claiming [MSK2]. [MSK1] is a moron. Therefore, [MSK2] is not true.","https://quizizz.com/admin/quiz/5cbde6b63d0929001a1ffc3c/logical-fallacies","tu quoque","I did not complete my homework last night? Well, you did not do yours last weak either.","",""
"[MSK1] is claiming [MSK2]. [MSK1] is a moron. Therefore, [MSK2] is not true.","https://www.logicallyfallacious.com/logicalfallacies/Genetic-Fallacy","genetic fallacy","He was born to Catholic parents and raised as a Catholic until his confirmation in 8th grade.  Therefore, he is bound to want to defend some Catholic traditions and, therefore, cannot be taken seriously."," I am referring to myself here.  While my upbringing was Catholic, and I have long since considered myself a Catholic, that is irrelevant to any defenses I make of Catholicism -- like the fact that many local churches do focus on helping the community through charity work.  If I make an argument defending anything Catholic, the argument should be evaluated on the argument itself, not on the history of the one making the argument or how I came to hold the claims as true or false.",""
"[MSK1] is claiming [MSK2]. [MSK1] is a moron. Therefore, [MSK2] is not true.","https://www.logicallyfallacious.com/logicalfallacies/Genetic-Fallacy","genetic fallacy","Lisa was brainwashed as a child into thinking that people are generally good.  Therefore, people are not generally good."," That fact that Lisa may have been brainwashed as a child, is irrelevant to the claim that people are generally good.",""
"[MSK1] is claiming [MSK2]. [MSK1] is a moron. Therefore, [MSK2] is not true.","https://www.proprofs.com/quiz-school/quizreport.php?title=logical-fallacies_2&sid=270424577","genetic fallacy","He’s just a psychology teacher at a community college","",""
"[MSK1] is claiming [MSK2]. [MSK1] is a moron. Therefore, [MSK2] is not true.","https://kspope.com/fallacies/fallacies.php","genetic fallacy","Since it was a deathbed confession, it must be true.","",""
"[MSK1] is claiming [MSK2]. [MSK1] is a moron. Therefore, [MSK2] is not true.","https://kspope.com/fallacies/fallacies.php","genetic fallacy","This theory originally occurred to a scientist in the form of a dream; therefore it cannot be valid.","",""
"[MSK1] is claiming [MSK2]. [MSK1] is a moron. Therefore, [MSK2] is not true.","https://www.pesec.no/24-most-common-logical-fallacies/","genetic fallacy","Accused on the 6 o'clock news of corruption and taking bribes, the senator said that we should all be very wary of the things we hear in the media, because we all know how very unreliable the media can be.","",""
"[MSK1] is claiming [MSK2]. [MSK1] is a moron. Therefore, [MSK2] is not true.","https://cdn.annenbergclassroom.org/wp-content/uploads/teacher.handout.sample.fallacies1.pdf","genetic fallacy","You’re a vegetarian? You do realize that Hitler was a vegetarian, too?","The fact that Hitler held a particular belief doesn’t make that belief wrong.",""
"[MSK1] is claiming [MSK2]. [MSK1] is a moron. Therefore, [MSK2] is not true.","https://cdn.annenbergclassroom.org/wp-content/uploads/teacher.handout.sample.fallacies1.pdf","genetic fallacy","Before he died, poet Allen Ginsberg argued in favor of legalizing pornography. But Ginsberg's arguments are nothing but trash. Ginsberg was a pot-smoking homosexual and a thoroughgoing advocate of the drug culture.","Rejects the argument based on the fact that Ginsberg is unsavory.",""
"[MSK1] is claiming [MSK2]. [MSK1] is a moron. Therefore, [MSK2] is not true.","https://cdn.annenbergclassroom.org/wp-content/uploads/teacher.handout.sample.fallacies1.pdf","genetic fallacy","According to Freud, your belief in God stems from your need for a strong father figure. So don’t you see that it’s silly to continue believing in God?","The origin of your belief in God has nothing to do with whether or not God exists.",""
"[MSK1] is claiming [MSK2]. [MSK1] is a moron. Therefore, [MSK2] is not true.","https://cdn.annenbergclassroom.org/wp-content/uploads/student.handout.common.fallacies2.pdf","genetic fallacy","You think labor unions are good? You know who else liked labor unions? Karl Marx, that’s who.","The argument rejects labor unions on the grounds that Marx liked unions without making any reference to any of the present arguments for or against labor unions.",""
"[MSK1] is claiming [MSK2]. [MSK1] is a moron. Therefore, [MSK2] is not true.","https://quizizz.com/admin/quiz/5f6c8014620e4f001b01d290/logic-unit-quiz","genetic fallacy","Don't buy any of the clothes made by that company. Most of them are made in China so they must be cheap.","",""
"[MSK1] is claiming [MSK2]. [MSK1] is a moron. Therefore, [MSK2] is not true.","https://quizizz.com/admin/quiz/5e39a9f211fb41001cada55c/logical-fallacies","genetic fallacy","My teacher always brings up stuff about Women's Rights. She only cares about it because she is a woman. The stats she shows us are probably bias.","",""
"[MSK1] is claiming [MSK2]. [MSK1] is a moron. Therefore, [MSK2] is not true.","https://quizizz.com/admin/quiz/5a80d327f21f740021abaa7f/logical-fallacies","genetic fallacy","Hannah argues that because her friend was brainwashed as a child into thinking that people are generally good, people are not generally good.","",""
"[MSK1] is claiming [MSK2]. [MSK1] is a moron. Therefore, [MSK2] is not true.","https://quizizz.com/admin/quiz/5e6b3c133d50bb001be4f453/logical-fallacies","genetic fallacy","Having come from the same political party, he is sure to communicate biased and untrue claims about his party-mates","",""
"[MSK1] is claiming [MSK2]. [MSK1] is a moron. Therefore, [MSK2] is not true.","https://quizizz.com/admin/quiz/607ee7628974e8001b0db45c/quick-check-logos-and-fallacies","genetic fallacy","The noble forefathers who created this great country did not fail; it is a great country now as it was then, by their very making.","",""
"[MSK1] is claiming [MSK2]. [MSK1] is a moron. Therefore, [MSK2] is not true.","https://thebestschools.org/magazine/15-logical-fallacies-know/","appeal to hypocrisy","But, Dad, I know you smoked when you were my age, so how can you tell me not to do it?","The tu quoque fallacy is an attempt to divert blame. The fallacy usually occurs when the arguer uses apparent hypocrisy to neutralize criticism and distract from the issue.",""
"[MSK1] is claiming [MSK2]. [MSK1] is a moron. Therefore, [MSK2] is not true.","https://thebestschools.org/magazine/15-logical-fallacies-know/","ad hominem","MacDougal roots for a British football team. Clearly he's unfit to be a police chief in Ireland.","This fallacy occurs when someone rejects or criticizes another point of view based on the personal characteristics, ethnic background, physical appearance, or other non-relevant traits of the person who holds it.",""
"[MSK1] is claiming [MSK2]. [MSK1] is a moron. Therefore, [MSK2] is not true.","https://web.archive.org/web/20070625122234/http://leo.stcloudstate.edu/acadwrite/logic.html","ad hominem","Oprah Winfrey's diet advice is useless;  she has had problems with maintaining her weight for most of her life, bouncing back and forth between being overweight and slender.","The writer reduces the credibility of the opposition by attacking them personally for who they are and not for what they say.  The validity of logical reasoning does not depend on the morality of the speaker.",""
"[MSK1] is claiming [MSK2]. [MSK1] is a moron. Therefore, [MSK2] is not true.","https://web.archive.org/web/20150713071518/http://www.nizkor.org/features/fallacies/circumstantial-ad-hominem.html","ad hominem","Bill claims that tax breaks for corporations increases development. Of course, Bill is the CEO of a corporation.","",""
"[MSK1] is claiming [MSK2]. [MSK1] is a moron. Therefore, [MSK2] is not true.","https://web.archive.org/web/20150713071518/http://www.nizkor.org/features/fallacies/circumstantial-ad-hominem.html","ad hominem","Of course the Senator from Maine opposes a reduction in naval spending. After all, Bath Ironworks, which produces warships, is in Maine.","",""
"[MSK1] is claiming [MSK2]. [MSK1] is a moron. Therefore, [MSK2] is not true.","https://web.archive.org/web/20150713071518/http://www.nizkor.org/features/fallacies/circumstantial-ad-hominem.html","ad hominem","I think that we should reject what Father Jones has to say about the ethical issues of abortion because he is a Catholic priest. After all, Father Jones is required to hold such views","",""
"[MSK1] is claiming [MSK2]. [MSK1] is a moron. Therefore, [MSK2] is not true.","https://web.archive.org/web/20150713071518/http://www.nizkor.org/features/fallacies/circumstantial-ad-hominem.html","ad hominem","She asserts that we need more military spending, but that is false, since she is only saying it because she is a Republican.","A Circumstantial ad Hominem is a fallacy in which one attempts to attack a claim by asserting that the person making the claim is making it simply out of self interest. ",""
"[MSK1] is claiming [MSK2]. [MSK1] is a moron. Therefore, [MSK2] is not true.","https://www.powerscore.com/lsat/help/lr_flaws.cfm","ad hominem","Mayor Jones’ anti-DUI campaign should not be taken seriously. After all, the mayor himself was cited for driving under the influence in college","Also known as an ad hominem attack (meaning “to the person”), a Source Argument commits a singular, consistent mistake by attacking the person/group making a claim (the source), as opposed to attacking the details of the claim itself. ","assuming that a claim is false on the grounds that the person defending it is of questionable character"
"[MSK1] is claiming [MSK2]. [MSK1] is a moron. Therefore, [MSK2] is not true.","http://www.testsherpa.com/lsat/secret-lsat-logic-flaws/","ad hominem","Boris is not qualified to make suggestions about our penal system. As an ex-convict, he would always take the criminals’ side.","The author attacks the supporter of another argument, instead of the argument itself.","Separate the attack on a person from the reasoning. Couldn’t it be just as true that Boris is more qualified to make suggestions than most, given that he’s seen the other side of the penal system?"
"[MSK1] is claiming [MSK2]. [MSK1] is a moron. Therefore, [MSK2] is not true.","https://www.lsat-center.com/prep-guide/ad-hominem/","genetic fallacy","Discoveries from Archimedes should be dismissed because he made them in a bathtub and not a proper university laboratory.","This is a fallacy where you dismiss something based on where it came from.",""
"[MSK1] is claiming [MSK2]. [MSK1] is a moron. Therefore, [MSK2] is not true.","https://quizizz.com/admin/quiz/607ee7628974e8001b0db45c/quick-check-logos-and-fallacies","genetic fallacy","My teacher says the Earth is flat, so it definitely is flat.","",""
"[MSK1] is claiming [MSK2]. [MSK1] is a moron. Therefore, [MSK2] is not true.","https://quizizz.com/admin/quiz/601d66c86088e4001bc1a9d9/fallacies-pt","genetic fallacy","Maria drives a car. She must be wealthy.","",""
"[MSK1] is claiming [MSK2]. [MSK1] is a moron. Therefore, [MSK2] is not true.","https://quizizz.com/admin/quiz/60548cc5a25098001b13f9f8/logical-fallacies","tu quoque","“But, Dad, I know you had no curfew when you were my age, so how can you give me a curfew?”","",""
"[MSK1] is claiming [MSK2]. [MSK1] is a moron. Therefore, [MSK2] is not true.","https://quizizz.com/admin/quiz/601d66c86088e4001bc1a9d9/fallacies-pt","genetic fallacy","You can't believe Bob's idea. He's a socialist.","",""
"[MSK1] is claiming [MSK2]. [MSK1] is a moron. Therefore, [MSK2] is not true.","https://quizizz.com/admin/quiz/5fc51524c0ffdb001b6b57ac/quiz-logical-fallacies","tu quoque","Sandy: ""You shouldn’t have that second piece of cake. It’s so fattening."" Ralph: ""Didn’t you eat an entire tub of ice cream yesterday?""","",""
"[MSK1] is claiming [MSK2]. [MSK1] is a moron. Therefore, [MSK2] is not true.","https://quizizz.com/admin/quiz/5daf7ec72f9b1b001b82cc7e/can-you-name-this-fallacy","ad hominem","What she says about Kepler's astronomy theory of the 1600's must be just so much garbage. Do you realize she's only fifteen years old?","",""
"[MSK1] is claiming [MSK2]. [MSK1] is a moron. Therefore, [MSK2] is not true.","https://www.logicallyfallacious.com/logicalfallacies/Traitorous-Critic-Fallacy","traitorous critic","Steve: In Sweden, college is free for citizens. How come we can't do that here? Ed: If you like Sweden so much, move there. The USA would be glad to be rid of your liberal ass!","Besides begging the question (Steve did not say he liked Sweden), Ed refused to address the question asked and deflected with a disingenuous question on why Steve does not move to Sweden.",""
"[MSK1] is claiming [MSK2]. [MSK1] is a moron. Therefore, [MSK2] is not true.","https://www.logicallyfallacious.com/logicalfallacies/Traitorous-Critic-Fallacy","traitorous critic","Gertrude: I am tired of having to fill out these forms all day. Can't we find a more efficient system? Cindy-Lou: If you're not happy with the way we do things, we can find someone who is!","Cindy-Lou did not address the concern, but essentially threatened Gertrude to shut up or lose her job. This example might also be seen as appeal to force .",""
"[MSK1] is claiming [MSK2]. [MSK1] is a moron. Therefore, [MSK2] is not true.","https://www.logicallyfallacious.com/logicalfallacies/Poisoning-the-Well","poisoning the well","I hope I presented my argument clearly.  Now, my opponent will attempt to refute my argument by his own fallacious, incoherent, illogical version of history."," Not a very nice setup for the opponent.  As an audience member, if you allow any of this “poison” to affect how you evaluate the opponent’s argument, you are guilty of fallacious reasoning.",""
"[MSK1] is claiming [MSK2]. [MSK1] is a moron. Therefore, [MSK2] is not true.","https://www.logicallyfallacious.com/logicalfallacies/Poisoning-the-Well","poisoning the well","Tim: Boss, you heard my side of the story why I think Bill should be fired and not me.  Now, I am sure Bill is going to come to you with some pathetic attempt to weasel out of this lie that he has created."," Tim is poisoning the well by priming his boss by attacking Bill’s character, and setting up any defense Bill might present as “pathetic”.  Tim is using this fallacious tactic here, but if the boss were to accept Tim’s advice about Bill, she would be committing the fallacy.",""
"[MSK1] is claiming [MSK2]. [MSK1] is a moron. Therefore, [MSK2] is not true.","https://quizizz.com/admin/quiz/60c66e403fb5ff001bc8192e/logical-fallacies-part","poisoning the well","Bill: ""I believe that abortion is morally wrong."" Dave: ""Of course you would say that, you’re a priest."" Bill: ""What about the arguments I gave to support my position?"" Dave: ""Those don’t count. Like I said, you’re a priest, so you have to say that abortion is wrong. Further, you are just a lackey to the Pope, so I can’t believe what you say.""","",""
"[MSK1] is claiming [MSK2]. [MSK1] is a moron. Therefore, [MSK2] is not true.","https://quizizz.com/admin/quiz/601343982b55e4001d363287/eapp-logical-fallacy","poisoning the well","""Do not listen to Luisa, she will only tell you lies about the recent activities given in our EAPP class.""","",""
"[MSK1] is claiming [MSK2]. [MSK1] is a moron. Therefore, [MSK2] is not true.","https://www.logicallyfallacious.com/logicalfallacies/Bulverism","bulverism","Mom: Remember, dear. Nobody's going to buy the cow if they get the milk for free. Daughter: You are only saying that because you are my mother. Daughter: Wait... did you just call me a cow?"," Mom is doing her best to advise her daughter that she should be a bit more sexually reserved with her male suitors, cautioning her that she is unlikely to get any commitments unless she holds back sex. Although the claim is indeed dubious, the daughter assumes that it is wrong because of the source (her mother) and her mother's suspected motives (to get her married). So the mother must be wrong (assumption) because of her motives, and it is because of her motives that she is wrong (circular reasoning and the genetic fallacy).",""
"[MSK1] is claiming [MSK2]. [MSK1] is a moron. Therefore, [MSK2] is not true.","https://www.logicallyfallacious.com/logicalfallacies/Bulverism","bulverism","Martin: All white people are not racists. Charlie: Yes they are. You just believe that because you are white.","Charlie is making two errors",""
"[MSK1] is claiming [MSK2]. [MSK1] is a moron. Therefore, [MSK2] is not true.","https://quizizz.com/admin/quiz/603c4135fe49e5001bc1c557/activity-march-logical-fallacies","poisoning the well","Don’t believe what Alex says about global warming. Alex dropped out of college!","",""
"[MSK1] is claiming [MSK2]. [MSK1] is a moron. Therefore, [MSK2] is not true.","https://examples.yourdictionary.com/examples-of-logical-fallacy.htmll","genetic fallacy","My best friend says you’re a liar, so I’m not going to talk to you.","involves acceptance or rejection of concepts based on their source, not their merit",""
"[MSK1] is claiming [MSK2]. [MSK1] is a moron. Therefore, [MSK2] is not true.","https://www.logicallyfallacious.com/logicalfallacies/Psychogenetic-Fallacy","bulverism; genetic fallacy","Lucas: I remember when I was about three years old my mother saved me from almost being eaten by a shark. Katie: I doubt that. What you are experiencing is what cognitive psychologists refer to as a ""false memory."""," There are two problems here that make Katie guilty of fallacious reasoning. First, she is assuming Lucas' story is not true because of a false memory. Second, she is phrasing this objection with unwarranted confidence.",""
"[MSK1] is claiming [MSK2]. [MSK1] is a moron. Therefore, [MSK2] is not true.","https://www.logicallyfallacious.com/logicalfallacies/Psychogenetic-Fallacy","bulverism; genetic fallacy","George: Man, those girls are smokin' hot! Derek: No, they're not. You're a victim of the cheerleader effect. When girls are together in a group, each girl looks a lot better than if you were to see her without the other girls."," Besides the fact that ""smokin' hot"" is a subjective evaluation, meaning that the girls could be hot to George but not Derek, Derek is assuming George's evaluation is wrong because of the psychological effect known as the cheerleader effect.",""
"[MSK1] is claiming [MSK2]. [MSK1] is a moron. Therefore, [MSK2] is not true.","https://kspope.com/fallacies/fallacies.php","tu quoque","I have been accused of using an ad hominem approach in trying to defend my research. But those who attack me and my research are also using ad hominem. And they started it!","",""
"[MSK1] is claiming [MSK2]. [MSK1] is a moron. Therefore, [MSK2] is not true.","https://quizizz.com/admin/quiz/5facd45ea2df0f001bd29f8f/fallacies-and-research","argument from fallacy; tu quoque","Lola: I don't think John would be a good fit to manage this project, because he doesn't have a lot of experience with project management. John: But you don't have a lot of experience in project management either!","",""
"[MSK1] is claiming [MSK2]. [MSK1] is a moron. Therefore, [MSK2] is not true.","https://www.logicallyfallacious.com/logicalfallacies/Ad-Hominem-Tu-quoque","ad hominem; tu quoque","Jimmy Swaggart argued strongly against sexual immorality, yet while married, he has had several affairs with prostitutes; therefore, sexual immorality is acceptable."," The fact Jimmy Swaggart likes to play a round of bedroom golf with some local entrepreneurial ladies, is not evidence for sexual immorality in general, only that he is sexually immoral.",""
