"updated_label","original_url","old_label","source_article","explanations","rationale"
"Either [MSK1] or [MSK2] is true.","https://www.mindtools.com/pages/article/newTMC_81.htm","false dilemma","We as the Board can either choose to approve this initial public offering or we can suffer slow annihilation at the hands of our competitors.","",""
"Either [MSK1] or [MSK2] is true.","https://quizizz.com/admin/quiz/610b247eaba1ad001c963c21/detective-fallacy","false dilemma","Dana is trying to raise money for her university's library. In her address to the board of trustees, she says, ""We must raise tuition to cover the cost of new books. Otherwise the library will be forced to close.""","",""
"Either [MSK1] or [MSK2] is true.","https://quizizz.com/admin/quiz/5f6c215473a960001b4b0054/philosophy-ct-unit-mc-practice","false dilemma","Growing up, many children are told to eat their dinner or else they would never grow big and tall.","",""
"Either [MSK1] or [MSK2] is true.","https://quizizz.com/admin/quiz/5e528b7fe6cfb3001ca07fd8/mankind-s-next-giant-leap","false dilemma","Either we re-elect Mayor Ruiz, or we watch our city fall to pieces","",""
"Either [MSK1] or [MSK2] is true.","https://quizizz.com/admin/quiz/5dd2aca5fc8633001bc7b986/fallacy-review","false dilemma","If you don’t say the Pledge of Allegiance, then you must be a traitor.","",""
"Either [MSK1] or [MSK2] is true.","https://quizizz.com/admin/quiz/5ae217e3a8edb0001b9cdacd/fallacies-quiz","false dilemma","""Either you recycle or you don't care about human life.""","",""
"[MSK1] has attribute [MSK2]. [MSK1] is a subset of [MSK3]. Therefore, all [MSK3] has attribute [MSK2].","https://quizizz.com/admin/quiz/5acf4dab10b79500199e447d/fallacies-bias-quiz","hasty generalization","Fred, the Australian, stole my wallet. Thus, all Australians are thieves.","",""
"[MSK1] has attribute [MSK2]. [MSK1] is a subset of [MSK3]. Therefore, all [MSK3] has attribute [MSK2].","https://quizizz.com/admin/quiz/5f5eb6911fc223001bc34b31/logical-fallacies","hasty generalization","In both of the murder mysteries I have read, the District Attorney was the culprit. All mystery writers like to make lawyers out to be villains.","",""
"[MSK1] has attribute [MSK2]. [MSK1] is a subset of [MSK3]. Therefore, all [MSK3] has attribute [MSK2].","https://quizizz.com/admin/quiz/5f5eb6911fc223001bc34b31/logical-fallacies","hasty generalization","My roommate said her philosophy class was difficult, and the one I’m in is difficult, too. All philosophy classes must be hard.","",""
"[MSK1] has attribute [MSK2]. [MSK1] is a subset of [MSK3]. Therefore, all [MSK3] has attribute [MSK2].","https://quizizz.com/admin/quiz/5e6b3c133d50bb001be4f453/logical-fallacies","hasty generalization","War on drugs instills fear to criminals so it can stop the crimes in the Philippines.","",""
"[MSK1] has attribute [MSK2]. [MSK1] is a subset of [MSK3]. Therefore, all [MSK3] has attribute [MSK2].","https://quizizz.com/admin/quiz/5e66ec8210bf64001b1fa963/logical-fallacies","hasty generalization","Jack is a good athlete. Jack comes from Canada. Therefore, all Canadians are good athletes.","",""
"[MSK1] has attribute [MSK2]. [MSK1] is a subset of [MSK3]. Therefore, all [MSK3] has attribute [MSK2].","https://quizizz.com/admin/quiz/5955a3f0181ab41000ac5a83/debate-fallacies","hasty generalization","""My roommate said her Debate class was hard, and the one that I'm in right now is hard, too. All Debate classes must be hard!”","",""
"[MSK1] has attribute [MSK2]. [MSK1] is a subset of [MSK3]. Therefore, all [MSK3] has attribute [MSK2].","https://quizizz.com/admin/quiz/5955a3f0181ab41000ac5a83/debate-fallacies","hasty generalization","While doing research for her debate topic on school uniforms, Sara discovered that a local elementary school survey indicated that 72% of its 1st graders wanted uniforms. She used this as evidence to support that all high schools should wear school uniforms.","",""
"[MSK1] has attribute [MSK2]. [MSK1] is a subset of [MSK3]. Therefore, all [MSK3] has attribute [MSK2].","https://quizizz.com/admin/quiz/6019e64ff54481001b028073/eapp-logic-live-quiz-alternative","hasty generalization","""You were late tonight. You must be cheating!""","",""
"[MSK1] has attribute [MSK2]. [MSK1] is a subset of [MSK3]. Therefore, all [MSK3] has attribute [MSK2].","https://academicinfluence.com/inflection/influence/logical-fallacies","faulty generalization","My grandmother smoked for 80 years and died at 100. Obviously, smoking isn’t harmful.","Also sometimes called a faulty generalization, this is a form of argument which arrives at a conclusion about numerous instances of a phenomenon based on evidence which is limited to only one or a few instances of said phenomenon. This denotes that one might attempt to generalize the explanation for an occurrence based on an unreliably small sample set.",""
"[MSK1] has attribute [MSK2]. [MSK1] is a subset of [MSK3]. Therefore, all [MSK3] has attribute [MSK2].","https://academicinfluence.com/inflection/influence/logical-fallacies","faulty generalization","My neighbor’s child was kidnapped while playing alone in her yard. My city must be a dangerous place for children.","Also sometimes called a faulty generalization, this is a form of argument which arrives at a conclusion about numerous instances of a phenomenon based on evidence which is limited to only one or a few instances of said phenomenon. This denotes that one might attempt to generalize the explanation for an occurrence based on an unreliably small sample set.",""
"[MSK1] has attribute [MSK2]. [MSK1] is a subset of [MSK3]. Therefore, all [MSK3] has attribute [MSK2].","https://thebestschools.org/magazine/15-logical-fallacies-know/","slippery slope","But you have to let me go to the party! If I don't go to the party, I'll be a loser with no friends. Next thing you know, I'll end up alone and jobless, living in your basement when I'm 30!","A slippery slope argument assumes that a certain course of action will necessarily lead to a chain of future events. ",""
"[MSK1] has attribute [MSK2]. [MSK1] is a subset of [MSK3]. Therefore, all [MSK3] has attribute [MSK2].","https://thebestschools.org/magazine/15-logical-fallacies-know/","slippery slope","If you miss practice, it means you were probably goofing off. People who goof off drop out of school and end up penniless.","The slippery slope fallacy takes a benign premise or starting point and suggests that it will lead to unlikely or ridiculous outcomes with no supporting evidence.",""
"[MSK1] has attribute [MSK2]. [MSK1] is a subset of [MSK3]. Therefore, all [MSK3] has attribute [MSK2].","https://www.powerscore.com/lsat/help/lr_flaws.cfm#section-circular","error of division","The United States is the wealthiest nation in the world. So every American is wealthy.","Presumes, without providing justification, that what is true of a whole must also be true of its constituent parts",""
"[MSK1] has attribute [MSK2]. [MSK1] is a subset of [MSK3]. Therefore, all [MSK3] has attribute [MSK2].","https://www.powerscore.com/lsat/help/lr_flaws.cfm#section-circular","error of composition","Gas prices have been rising steadily these past few years. Thus, the cost of car ownership is higher than it was previously.","you cannot assume that just because you know something about a component or entity within a group that the same information will apply to the group as a whole (or to the entire entity being considered).",""
"[MSK1] has attribute [MSK2]. [MSK1] is a subset of [MSK3]. Therefore, all [MSK3] has attribute [MSK2].","https://thebestschools.org/magazine/15-logical-fallacies-know/","hasty generalization","People nowadays only vote with their emotions instead of their brains.","A hasty generalization is a claim based on a few examples rather than substantial proof. Arguments based on hasty generalizations often don't hold up due to a lack of supporting evidence: The claim might be true in one case, but that doesn't mean it's always true.",""
"[MSK1] has attribute [MSK2]. [MSK1] is a subset of [MSK3]. Therefore, all [MSK3] has attribute [MSK2].","http://websites.umich.edu/~elements/5e/toc/SCPS,3rdEdBookCh03.pdf","hasty generalization","All football players are dumb jocks.","","Clearly there are many engineers who are outgoing and football players who are very intelligent. It is very dangerous to make sweeping generalizations regarding a group based on limited experience."
"[MSK1] has attribute [MSK2]. [MSK1] is a subset of [MSK3]. Therefore, all [MSK3] has attribute [MSK2].","http://websites.umich.edu/~elements/5e/toc/SCPS,3rdEdBookCh03.pdf","hasty generalization","All engineers are introverts who would rather relate to computers than people. ","Draws a conclusion about a large group based on the experiences of a few members of the group.","Clearly there are many engineers who are outgoing and football players who are very intelligent. It is very dangerous to make sweeping generalizations regarding a group based on limited experience."
"[MSK1] has attribute [MSK2]. [MSK1] is a subset of [MSK3]. Therefore, all [MSK3] has attribute [MSK2].","https://web.archive.org/web/20070625122234/http://leo.stcloudstate.edu/acadwrite/logic.html","hasty generalization","All Greek food causes illness;  when I traveled through Greece, I got food  poisoning.","The writer makes a rule out of particular experiences to support the claim.  As soon as an exception to the derived rule is found, the rule fails to support the argument.",""
"[MSK1] has attribute [MSK2]. [MSK1] is a subset of [MSK3]. Therefore, all [MSK3] has attribute [MSK2].","https://www.powerscore.com/lsat/help/lr_flaws.cfm#section-circular","overgeneralization","My friend swears the mechanic at that shop overcharged her last week and after looking at her invoice it seems she’s right. So don’t take your business there, as you’ll definitely get ripped off.","Supports a universal claim on the basis of a single example",""
"[MSK1] has attribute [MSK2]. [MSK1] is a subset of [MSK3]. Therefore, all [MSK3] has attribute [MSK2].","https://quizizz.com/admin/quiz/5fac75e5dc466f001c2cbeeb/logical-fallacies","hasty generalization","All Muslims are terrorists","",""
"[MSK1] has attribute [MSK2]. [MSK1] is a subset of [MSK3]. Therefore, all [MSK3] has attribute [MSK2].","https://philosophy.hku.hk/think/fallacy/list.php","slippery slope","""The government should not prohibit drugs. Otherwise the government should also ban alcohol or cigarettes. And then fatty food and junk food would have to be regulated too. The next thing you know, the government would force us to brush our teeth and do exercises everyday.""","Arguing that if an opponent were to accept some claim C1, then he or she has to accept some other closely related claim C2, which in turn commits the opponent to a still further claim C3, eventually leading to the conclusion that the opponent is committed to something absurd or obviously unacceptable. This style of argumentation constitutes a fallacy only when it is inappropriate to think if one were to accept the initial claim, one must accept all the other claims.",""
"[MSK1] has attribute [MSK2]. [MSK1] is a subset of [MSK3]. Therefore, all [MSK3] has attribute [MSK2].","https://userweb.ucs.louisiana.edu/~kak7409/Fallacies.html","slippery slope","""A person apparently hopelessly ill may be allowed to take his own life. Then he may be permitted to deputize others to do it for him should he no longer be able to act. The judgment of others then becomes the ruling factor. Already at this point euthanasia is not personal and voluntary, for others are acting on behalf of the patient as they see fit. This may well incline them to act on behalf of other patients who have not authorized them to exercise their judgment. It is only a short step, then, from voluntary euthanasia (self-inflicted or authorized), to directed euthanasia administered to a patient who has given no authorization, to involuntary euthanasia conducted as a part of a social policy.""","It's unlikely that permitting euthanasia in a restricted set of cases is likely to result in mass unjust killings, especially in contemporary American society.",""
"[MSK1] has attribute [MSK2]. [MSK1] is a subset of [MSK3]. Therefore, all [MSK3] has attribute [MSK2].","https://userweb.ucs.louisiana.edu/~kak7409/Fallacies.html","slippery slope","""I think that the use of marijuana as a medical treatment shouldn't even be considered. If we make drugs legal in a few cases, then we might eventually have to completely legalize them - which is even crazier than Proposition 215. If we want to help people out by letting them do illegal things, then let's just get rid of all our laws.""","It's unlikely that drugs will be completely legalized, or that we'll get rid of all our laws, as a result of allowing marijuana to be prescribed in a limited range of cases.",""
"[MSK1] has attribute [MSK2]. [MSK1] is a subset of [MSK3]. Therefore, all [MSK3] has attribute [MSK2].","https://userweb.ucs.louisiana.edu/~kak7409/Fallacies.html","slippery slope","""There is ... a radical element, a homosexual agenda that wants to redefine what marriage is. They want to say that a marriage not only is one man and one woman but it is two men or it is two women. What logical reason is there to keep us from stopping expansion of that definition to include three people or an adult and a child, or any other odd combination that we want to have?  ... and it does not even have to be limited to human beings by the way. I mean it could be anything. ... There is no reason why we cannot just completely erase whatever boundaries that currently exist on the definition of marriage and say it is a free-for-all, anything goes.""","Permitting homosexuals to legally marry is unlikely to result in, e.g., laws permitting an adult to marry a sheep, etc.",""
"[MSK1] has attribute [MSK2]. [MSK1] is a subset of [MSK3]. Therefore, all [MSK3] has attribute [MSK2].","https://quizizz.com/admin/quiz/5ffdbb6b36ee14001ec3829e/fallacies","hasty generalization","I can tell this movie is going to be terrible; the opening credits aren't even over yet!","",""
"[MSK1] has attribute [MSK2]. [MSK1] is a subset of [MSK3]. Therefore, all [MSK3] has attribute [MSK2].","https://quizizz.com/admin/quiz/5e528b7fe6cfb3001ca07fd8/mankind-s-next-giant-leap","hasty generalization","Everyone who likes pizza likes pepperoni","",""
"[MSK1] has attribute [MSK2]. [MSK1] is a subset of [MSK3]. Therefore, all [MSK3] has attribute [MSK2].","https://quizizz.com/admin/quiz/5d90f216d258e4001a11c33c/fun-with-fallacies","hasty generalization","Teachers don't have lives.""My best friend said her English class was hard, and the one I'm in is hard too. All English classes must be hard.""","",""
"[MSK1] has attribute [MSK2]. [MSK1] is a subset of [MSK3]. Therefore, all [MSK3] has attribute [MSK2].","https://quizizz.com/admin/quiz/60332e20073770001d1ef61f/english-review","hasty generalization","My cousin said her Math class was hard. The one that I’m in is hard too. All Math classes must be hard.","",""
"[MSK1] has attribute [MSK2]. [MSK1] is a subset of [MSK3]. Therefore, all [MSK3] has attribute [MSK2].","https://quizizz.com/admin/quiz/5cb0c70b48b73f001a2f710e/persuasive-unit-quiz-review","hasty generalization","All chess players are geniuses.","",""
"[MSK1] has attribute [MSK2]. [MSK1] is a subset of [MSK3]. Therefore, all [MSK3] has attribute [MSK2].","https://quizizz.com/admin/quiz/58ab8190b2798b6777134b36/persuasive-techniques-and-logical-fallacies","hasty generalization","""Blondes are less intelligent than people with other hair colors.""","",""
"[MSK1] has attribute [MSK2]. [MSK1] is a subset of [MSK3]. Therefore, all [MSK3] has attribute [MSK2].","https://academicinfluence.com/inflection/influence/logical-fallacies","faulty generalization","I know five people from Kentucky. They are all racists. Therefore, Kentuckians are racist.","Also sometimes called a faulty generalization, this is a form of argument which arrives at a conclusion about numerous instances of a phenomenon based on evidence which is limited to only one or a few instances of said phenomenon. This denotes that one might attempt to generalize the explanation for an occurrence based on an unreliably small sample set.",""
"[MSK1] has attribute [MSK2]. [MSK1] is a subset of [MSK3]. Therefore, all [MSK3] has attribute [MSK2].","https://academicinfluence.com/inflection/influence/logical-fallacies","faulty generalization","I know four poor families. They are lazy drug addicts. Therefore, all poor people are lazy drug addicts.","Also sometimes called a faulty generalization, this is a form of argument which arrives at a conclusion about numerous instances of a phenomenon based on evidence which is limited to only one or a few instances of said phenomenon. This denotes that one might attempt to generalize the explanation for an occurrence based on an unreliably small sample set.",""
"[MSK1] has attribute [MSK2]. [MSK1] is a subset of [MSK3]. Therefore, all [MSK3] has attribute [MSK2].","https://quizizz.com/admin/quiz/5f92210a751b3b001b2262a2/logical-fallacies","hasty generalization","He has smoked cigarettes his entire life and he doesn't have lung cancer. Therefore smoking doesn't cause lung cancer.","",""
"[MSK1] has attribute [MSK2]. [MSK1] is a subset of [MSK3]. Therefore, all [MSK3] has attribute [MSK2].","https://quizizz.com/admin/quiz/591cafca6f261f1700497ef1/english-final","hasty generalization","Almost all of the students I talked to said that they don't like the senator. I'm sure he'll lose the election on Tuesday.","",""
"[MSK1] has attribute [MSK2]. [MSK1] is a subset of [MSK3]. Therefore, all [MSK3] has attribute [MSK2].","https://quizizz.com/admin/quiz/5f92210a751b3b001b2262a2/logical-fallacies","hasty generalization","If I went to the mall a polled 3 people, those opinions would not represent the opinions of the city population.","",""
"[MSK1] has attribute [MSK2]. [MSK1] is a subset of [MSK3]. Therefore, all [MSK3] has attribute [MSK2].","https://quizizz.com/admin/quiz/5fb68f454a24b300206df12f/logos-fallacies","hasty generalization","I saw that dog eat chicken so all dogs must only eat chicken.","",""
"[MSK1] has attribute [MSK2]. [MSK1] is a subset of [MSK3]. Therefore, all [MSK3] has attribute [MSK2].","https://quizizz.com/admin/quiz/5fb68f454a24b300206df12f/logos-fallacies","hasty generalization","I saw two women get in a car accident. Therefore, all women are bad drivers","",""
"[MSK1] has attribute [MSK2]. [MSK1] is a subset of [MSK3]. Therefore, all [MSK3] has attribute [MSK2].","https://quizizz.com/admin/quiz/5ddc131a4e358d001b70521d/false-assumptions-fallacies","hasty generalization","Sometimes flu vaccines don’t work, therefore vaccines are useless.","",""
"[MSK1] has attribute [MSK2]. [MSK1] is a subset of [MSK3]. Therefore, all [MSK3] has attribute [MSK2].","https://quizizz.com/admin/quiz/5ddc131a4e358d001b70521d/false-assumptions-fallacies","hasty generalization","My neighbor's cat attacked me, therefore all cats are evil.","",""
"[MSK1] has attribute [MSK2]. [MSK1] is a subset of [MSK3]. Therefore, all [MSK3] has attribute [MSK2].","https://quizizz.com/admin/quiz/607458ee15ccc6001be76514/logical-fallacy","hasty generalization","Which rhetorical fallacy is a broad statement about people on the basis of gender, ethnicity, race, or political, social, professional, or religious group?","",""
"[MSK1] has attribute [MSK2]. [MSK1] is a subset of [MSK3]. Therefore, all [MSK3] has attribute [MSK2].","https://quizizz.com/admin/quiz/5a81e5020e9927002171f465/rhetorical-fallacies","hasty generalization","Why did the blonde cross the road?  Because she saw a shoe sale!","",""
"[MSK1] has attribute [MSK2]. [MSK1] is a subset of [MSK3]. Therefore, all [MSK3] has attribute [MSK2].","https://quizizz.com/admin/quiz/5a81e5020e9927002171f465/rhetorical-fallacies","hasty generalization","All of my red-headed friends are good dancers. Therefore, all red-headed people must be good dancers.","",""
"[MSK1] has attribute [MSK2]. [MSK1] is a subset of [MSK3]. Therefore, all [MSK3] has attribute [MSK2].","https://quizizz.com/admin/quiz/58500e401c6f222779510f06/rhetorical-fallacies","hasty generalization","A lion is a cat and cats are good pets so a lion must be a good pet.","",""
"[MSK1] has attribute [MSK2]. [MSK1] is a subset of [MSK3]. Therefore, all [MSK3] has attribute [MSK2].","https://quizizz.com/admin/quiz/5ffa8a77952dd8001dc18419/logical-fallacy","hasty generalization","Two members of my team have become more engaged employees after taking public speaking classes. That proves we should have mandatory public speaking classes for the whole company to improve employee engagement.","",""
"[MSK1] has attribute [MSK2]. [MSK1] is a subset of [MSK3]. Therefore, all [MSK3] has attribute [MSK2].","https://quizizz.com/admin/quiz/5afbba52bb114c001c2d4e43/logical-fallacy-quiz","hasty generalization","""I don't know how to complete my geometry homework tonight; I probably can't pass the course since I can't do this one assignment.""","",""
"[MSK1] has attribute [MSK2]. [MSK1] is a subset of [MSK3]. Therefore, all [MSK3] has attribute [MSK2].","https://quizizz.com/admin/quiz/5f6c215473a960001b4b0054/philosophy-ct-unit-mc-practice","hasty generalization","You have a friend who claims that cats like to go to windows and watch sunsets because that is what her cats does.","",""
"[MSK1] has attribute [MSK2]. [MSK1] is a subset of [MSK3]. Therefore, all [MSK3] has attribute [MSK2].","https://quizizz.com/admin/quiz/5c3fa485496da9001b98b7d7/advertising-techniques","hasty generalization","Unfair judgement of people based on looks, belief, or ethnic background.","",""
"[MSK1] has attribute [MSK2]. [MSK1] is a subset of [MSK3]. Therefore, all [MSK3] has attribute [MSK2].","https://quizizz.com/admin/quiz/5c3fedfb7e72ee001a76fce6/persuasive-text-quiz","hasty generalization","All writing teachers must be awesome because Ms. Lopez is.","",""
"[MSK1] has attribute [MSK2]. [MSK1] is a subset of [MSK3]. Therefore, all [MSK3] has attribute [MSK2].","https://www.lsat-center.com/prep-guide/argumentative-flaws/","slippery slope","The anti-terrorist laws that monitor international currency transfers, phone calls, and emails are the first step to turning our fragile democracy into a new Nazi regime.","This argument assumes that if one bad thing happens, then another much worse thing will necessarily happen.","Although infringements of civil liberties are troublesome, it is another argument to suggest infringements of civil liberties will lead to a fascist dictatorship."
"[MSK1] has attribute [MSK2]. [MSK1] is a subset of [MSK3]. Therefore, all [MSK3] has attribute [MSK2].","https://quizizz.com/admin/quiz/5c3fedfb7e72ee001a76fce6/persuasive-text-quiz","hasty generalization","I can't trust the mayor or the governor. All politicians must be liars.","",""
"[MSK1] has attribute [MSK2]. [MSK1] is a subset of [MSK3]. Therefore, all [MSK3] has attribute [MSK2].","https://quizizz.com/admin/quiz/601d66c86088e4001bc1a9d9/fallacies-pt","hasty generalization","My dog got sprayed by a skunk this morning on the trail; therefore, trail running is dangerous.","",""
"[MSK1] has attribute [MSK2]. [MSK1] is a subset of [MSK3]. Therefore, all [MSK3] has attribute [MSK2].","https://quizizz.com/admin/quiz/601d66c86088e4001bc1a9d9/fallacies-pt","hasty generalization","""The two courses I took at UWI were not very interesting. I don't think its a good university.""","",""
"[MSK1] has attribute [MSK2]. [MSK1] is a subset of [MSK3]. Therefore, all [MSK3] has attribute [MSK2].","https://quizizz.com/admin/quiz/604cfcb11c34ee001b0bd464/unit-test-review","hasty generalization","ALL teenagers are irresponsible","",""
"[MSK1] has attribute [MSK2]. [MSK1] is a subset of [MSK3]. Therefore, all [MSK3] has attribute [MSK2].","https://quizizz.com/admin/quiz/5cb0c70b48b73f001a2f710e/persuasive-unit-quiz-review","hasty generalization","Trying to finish a marathon is impossible, I know because I tried it once.","",""
"[MSK1] has attribute [MSK2]. [MSK1] is a subset of [MSK3]. Therefore, all [MSK3] has attribute [MSK2].","https://quizizz.com/admin/quiz/5f721b51788f0a001bd242c3/fallacies","hasty generalization","My mom says that most tourist from France are rude. She had to wait on one the other day and the lady threw her pancakes on the ground because they were not big enough.","",""
"[MSK1] has attribute [MSK2]. [MSK1] is a subset of [MSK3]. Therefore, all [MSK3] has attribute [MSK2].","https://quizizz.com/admin/quiz/6035c01463468c001c48185e/fallacies","hasty generalization","My friend said her Math class was hard, and the one I’m in is hard, too. All Math classes must be hard!","",""
"[MSK1] has attribute [MSK2]. [MSK1] is a subset of [MSK3]. Therefore, all [MSK3] has attribute [MSK2].","https://quizizz.com/admin/quiz/60b4f4000f8488001b40c84c/types-of-logical-fallacy","hasty generalization","There was a fight at school today. Violence is a growing problem in school.","",""
"[MSK1] has attribute [MSK2]. [MSK1] is a subset of [MSK3]. Therefore, all [MSK3] has attribute [MSK2].","https://quizizz.com/admin/quiz/5e8628e30898e2001c4360ea/types-of-evidence","hasty generalization","We should go inside; the last time the clouds were that dark, there was a tornado.","",""
"[MSK1] has attribute [MSK2]. [MSK1] is a subset of [MSK3]. Therefore, all [MSK3] has attribute [MSK2].","https://quizizz.com/admin/quiz/5dcb28944bb29b001f3c5e53/logical-fallacies-false-logic","hasty generalization","After I listened to the first song of my favorite musician’s new vinyl record, I knew I’d hate the entire record, so I converted it into a Frisbee.","",""
