"updated_label","original_url","old_label","source_article","explanations","rationale"
"If [MSK1] is true, then [MSK2] is true. [MSK2] is true. Therefore, [MSK1] is true.","https://www.logicallyfallacious.com/logicalfallacies/Non-Sequitur","non-sequitur","People generally like to walk on the beach.  Beaches have sand.  Therefore, having sand floors in homes would be a great idea!"," As cool as the idea of sand floors might sound, the conclusion does not follow from the premises.  The fact that people generally like to walk on sand does not mean that they want sand in their homes, just like because people generally like to swim, they shouldn’t flood their houses.",""
"If [MSK1] is true, then [MSK2] is true. [MSK2] is true. Therefore, [MSK1] is true.","https://www.logicallyfallacious.com/logicalfallacies/Non-Sequitur","non-sequitur","Buddy Burger has the greatest food in town.  Buddy Burger was voted #1 by the local paper.  Therefore, Phil, the owner of Buddy Burger, should run for president of the United States."," I bet Phil makes one heck of a burger, but it does not follow that he should be president.",""
"If [MSK1] is true, then [MSK2] is true. [MSK2] is true. Therefore, [MSK1] is true.","https://quizizz.com/admin/quiz/5e46e2e7e55b37001bcd76e9/logic-guide-quiz","argument from fallacy","Ivan: You cannot borrow my car because it turns back into a pumpkin at midnight. Sidney: If you really think that, you’re an idiot. Ivan: That is an ad hominem; therefore, I can’t be an idiot. Sidney: I beg to differ.","",""
"If [MSK1] is true, then [MSK2] is true. [MSK2] is true. Therefore, [MSK1] is true.","https://cdn.annenbergclassroom.org/wp-content/uploads/teacher.handout.sample.fallacies1.pdf","undistributed middle","Poetry is a based on rhythm, and music is based on rhythm, so isn't poetry a kind of music?","Has the form A is B and C is B so A is C.",""
"If [MSK1] is true, then [MSK2] is true. [MSK2] is true. Therefore, [MSK1] is true.","https://cdn.annenbergclassroom.org/wp-content/uploads/student.handout.common.fallacies2.pdf","undistributed middle","Most Arabs are Muslims and all the 9/11 hijackers were also Muslims. Therefore most Arabs are hijackers.","The conclusion doesn’t follow from the premises. To show this, substitute the following argument: My 5-year-old enjoys watching television, and teenagers also enjoy watching television. Therefore my 5-year-old is a teenager.",""
"If [MSK1] is true, then [MSK2] is true. [MSK2] is true. Therefore, [MSK1] is true.","https://quizizz.com/admin/quiz/599efbff85c2391000f1bea7/argumentation","non-sequitur","Cotton and grain crops were lower this year than last. So, people must be stealing them.","",""
"If [MSK1] is true, then [MSK2] is true. [MSK2] is true. Therefore, [MSK1] is true.","https://www.logicallyfallacious.com/logicalfallacies/Argument-from-Fallacy","argument from fallacy","Karen: I am sorry, but if you think man used to ride dinosaurs, then you are obviously not very well educated. Kent:  First of all, I hold a PhD in creation science, so I am well-educated.  Second of all, your ad hominem attack shows that you are wrong, and man did use to ride dinosaurs. Karen:  Getting your PhD in a couple of months, from a “college” in a trailer park, is not being well-educated.  My fallacy in no way is evidence for man riding on dinosaurs, and despite what you may think, the Flintstone’s was not a documentary!","Karen’s ad hominem (abusive) in her initial statement has nothing to do with the truth value of the argument that man used to ride dinosaurs.",""
"If [MSK1] is true, then [MSK2] is true. [MSK2] is true. Therefore, [MSK1] is true.","https://www.pesec.no/24-most-common-logical-fallacies/","argument from fallacy","Recognising that Amanda had committed a fallacy in arguing that we should eat healthy food because a nutritionist said it was popular, Alyse said we should therefore eat bacon double cheeseburgers every day.","",""
"If [MSK1] is true, then [MSK2] is true. [MSK2] is true. Therefore, [MSK1] is true.","https://www.ucm.es/data/cont/docs/107-2016-02-17-Fallacious%20Arguments.pdf","non-sequitur","Tens of thousands of Americans have seen lights in the night sky which they could not identify. The existence of life on other planets is fast becoming certainty !","",""
"If [MSK1] is true, then [MSK2] is true. [MSK2] is true. Therefore, [MSK1] is true.","https://quizizz.com/admin/quiz/5f5eb6911fc223001bc34b31/logical-fallacies","non-sequitur","He sometimes behaves violently when I am around him. I don't know what it is that I am doing to make him become so violent.","",""
"If [MSK1] is true, then [MSK2] is true. [MSK2] is true. Therefore, [MSK1] is true.","https://quizizz.com/admin/quiz/606e159096512c001b668565/logical-fallacies","non-sequitur","She's wearing red shoes. Her favorite color must be red.","",""
"If [MSK1] is true, then [MSK2] is true. [MSK2] is true. Therefore, [MSK1] is true.","https://quizizz.com/admin/quiz/5f92210a751b3b001b2262a2/logical-fallacies","non-sequitur","""We both like music, so we should get married.""","",""
"If [MSK1] is true, then [MSK2] is true. [MSK2] is true. Therefore, [MSK1] is true.","https://quizizz.com/admin/quiz/5dfa3507a2918c001b19927c/rhetorical-fallacies-practice","non-sequitur","How can I be expected to do my homework when billions of people around the world are throwing their plastic water bottles away without recycling them?","",""
"If [MSK1] is true, then [MSK2] is true. [MSK2] is true. Therefore, [MSK1] is true.","https://quizizz.com/admin/quiz/57ed12c2ab9ee6a72c85dad2/weekly-quiz-review","non-sequitur","Someone who says something which does not flow logically in the conversation is guilty of using:","",""
"If [MSK1] is true, then [MSK2] is true. [MSK2] is true. Therefore, [MSK1] is true.","https://quizizz.com/admin/quiz/5fa314fe29f97f001b7e198f/fallacy-quiz","non-sequitur","My fridge isn't working. I should probably finish that book I've been reading.","",""
"If [MSK1] is true, then [MSK2] is true. [MSK2] is true. Therefore, [MSK1] is true.","https://quizizz.com/admin/quiz/5f92210a751b3b001b2262a2/logical-fallacies","non-sequitur","""1 is a number and 2 is a number so 1 = 2""","",""
"If [MSK1] is true, then [MSK2] is true. [MSK2] is true. Therefore, [MSK1] is true.","https://quizizz.com/admin/quiz/5f92210a751b3b001b2262a2/logical-fallacies","non-sequitur","""Men are human. Mary is a human. Therefore, Mary is a man.""","",""
"If [MSK1] is true, then [MSK2] is true. [MSK2] is true. Therefore, [MSK1] is true.","https://www.logicallyfallacious.com/logicalfallacies/Fallacy-of-the-Undistributed-Middle","undistributed middle","All ghosts are imaginary. All unicorns are imaginary. Therefore, all ghosts are unicorns."," While there may be ghosts that are unicorns, it does not follow from the premises",""
"If [MSK1] is true, then [MSK2] is true. [MSK2] is true. Therefore, [MSK1] is true.","https://quizizz.com/admin/quiz/601d66c86088e4001bc1a9d9/fallacies-pt","non-sequitur","Bats are mammals. Bats can fly. Pigs are also mammals, therefore pigs can fly.","",""
"If [MSK1] is true, then [MSK2] is true. [MSK2] is true. Therefore, [MSK1] is true.","https://quizizz.com/admin/quiz/601d66c86088e4001bc1a9d9/fallacies-pt","non-sequitur","I would have done my homework, but my refrigerator stopped working.","",""
"If [MSK1] is true, then [MSK2] is true. [MSK2] is true. Therefore, [MSK1] is true.","https://quizizz.com/admin/quiz/5955a3f0181ab41000ac5a83/debate-fallacies","non-sequitur","""The research I found on cell phone use in the classroom suggests that students can be distracted when they have access to texting. This leads me to believe that all high school students should not be allowed to have their phones on them at school anytime.","",""
"If [MSK1] is true, then [MSK2] is true. [MSK2] is true. Therefore, [MSK1] is true.","https://quizizz.com/admin/quiz/5da9e081053807001aa9c382/logical-fallacies","non-sequitur","Person A: ""What's the weather like?"" Person B: ""It's 2:00""","",""
"If [MSK1] is true, then [MSK2] is true. [MSK2] is true. Therefore, [MSK1] is true.","https://quizizz.com/admin/quiz/606da344cc5eda001ba2e53c/fallacies-quiz","non-sequitur","We must have a poltergeist in the house. When the dog ran under the table, the vase just seemed to jump off the shelf all by itself.","",""
"If [MSK1] is true, then [MSK2] is true. [MSK2] is true. Therefore, [MSK1] is true.","https://quizizz.com/admin/quiz/5f92210a751b3b001b2262a2/logical-fallacies","non-sequitur","""If my hair looks nice, people will love me.""","",""
"If [MSK1] is true, then [MSK2] is true. [MSK2] is true. Therefore, [MSK1] is true.","https://quizizz.com/admin/quiz/5fb29e126d2ec0001d4a5017/logical-fallacies","non-sequitur","He has my vote for senator, because he has the best shirts.","",""
"If [MSK1] is true, then [MSK2] is true. [MSK2] is true. Therefore, [MSK1] is true.","https://quizizz.com/admin/quiz/5d922913b68824001a751943/logical-fallacies","non-sequitur","Girl:"" I'm worried that my friend is mad at me."" Friend: ""I wonder what you call a male lady bug?""","",""
"If [MSK1] is true, then [MSK2] is true. [MSK2] is true. Therefore, [MSK1] is true.","https://quizizz.com/admin/quiz/580e34f556bd584f78ecbb48/logical-fallacies","non-sequitur","All men are mortal, and Socrates is a man, therefore Socrates likes dogs.","",""
"If [MSK1] is true, then [MSK2] is true. [MSK2] is true. Therefore, [MSK1] is true.","https://quizizz.com/admin/quiz/601ab1436b68c3001b346fbc/logical-fallacy","non-sequitur","We should stop using hairspray because it is snowing in New York.","",""
"If [MSK1] is true, then [MSK2] is true. [MSK2] is true. Therefore, [MSK1] is true.","https://www.logicallyfallacious.com/logicalfallacies/Affirming-a-Disjunct","affirming a disjunct","I am going to bed or watching TV.  I am exhausted, so I will go to bed; therefore, I cannot watch TV."," It is logically and physically possible to go to bed and watch TV at the same time, I know that for a fact as I do it just about every night.  The “or” does not logically exclude the option that is not chosen.",""
"If [MSK1] is true, then [MSK2] is true. [MSK2] is true. Therefore, [MSK1] is true.","https://quizizz.com/admin/quiz/5f92210a751b3b001b2262a2/logical-fallacies","non-sequitur","""If you buy a computer, you will become smarter.""","",""
"If [MSK1] is true, then [MSK2] is true. [MSK2] is true. Therefore, [MSK1] is true.","https://quizizz.com/admin/quiz/5c890a34b355a3001d6addb9/logical-fallacies","non-sequitur","Good people don't lie. You told a lie. Therefore, you are not a good person.","",""
"If [MSK1] is true, then [MSK2] is true. [MSK2] is true. Therefore, [MSK1] is true.","https://www.logicallyfallacious.com/logicalfallacies/Illicit-Substitution-of-Identicals","masked-man fallacy","The lady in the pink dress is Julia Roberts. The reporter thinks Julia Roberts drives a Prius. Therefore, the reporter thinks the lady in the pink dress drives a Prius."," The examples used are just two different logical forms of the same fallacy.  Because the reporter, “thinks” the statement is made in an intensional context, we cannot switch the terms.  However, if we were to keep the premises in an extensional context, we could get away with switching the terms.  This would be a valid logical argument form known as Leibniz’ Law.",""
"If [MSK1] is true, then [MSK2] is true. [MSK2] is true. Therefore, [MSK1] is true.","https://www.svcc.edu/academics/pass/ela/overview-documents/5-logical-fallacies.pdf","false analogy","Putting teenagers in sex-education classes is like taking an alcoholic to a bar.","(Are the things being compared even similar? Does that prove anything?)",""
"If [MSK1] is true, then [MSK2] is true. [MSK2] is true. Therefore, [MSK1] is true.","https://www.logicallyfallacious.com/logicalfallacies/Fallacy-of-Four-Terms","four terms","All Greek gods are mythical. All modern day gods are real. Therefore, all Greek gods are real."," Again, nonsense.  If we take away one of the terms, we end up with a valid syllogism",""
"If [MSK1] is true, then [MSK2] is true. [MSK2] is true. Therefore, [MSK1] is true.","https://www.logicallyfallacious.com/logicalfallacies/Denying-the-Antecedent","denying the antecedent","If I have cable, then I have seen a naked lady. I don’t have cable. Therefore, I have never seen a naked lady."," The fallacy is more obvious here than in the first example. Denying the antecedent (saying that I don’t have cable) does not mean we must deny the consequent (that I have seen a naked lady...I have, by the way, in case you were wondering). The arguer has committed a formal fallacy, and the argument is invalid because the truth of the premises does not guarantee the truth of the conclusion.",""
"If [MSK1] is true, then [MSK2] is true. [MSK2] is true. Therefore, [MSK1] is true.","https://courses.lumenlearning.com/englishcomp1/chapter/common-logical-fallacies/","non sequitur","I hear the rain falling outside my window; therefore, the sun is not shining.","",""
"If [MSK1] is true, then [MSK2] is true. [MSK2] is true. Therefore, [MSK1] is true.","https://web.archive.org/web/20070625122234/http://leo.stcloudstate.edu/acadwrite/logic.html","denial of the antecedent","If the ozone layer is destroyed, many people will get cancer and suffer from other illnesses.  The ozone layer is being protected, not destroyed.  So, many people will be spared the pain of cancer and other illnesses.","Again, the writer employs an If...then statement, but in this case, the writer denies the If part so that the negation of the then part can be concluded.  However, just because the If part does not happen, it does not follow that the then part will not happen.  The then part could result for some other reason.",""
"If [MSK1] is true, then [MSK2] is true. [MSK2] is true. Therefore, [MSK1] is true.","https://web.archive.org/web/20070625122234/http://leo.stcloudstate.edu/acadwrite/logic.html","questionable premises","All judges are fair-minded individuals;  therefore, Judge Ito is fair in his decisions.","The writer's reasons for holding a belief are not as obvious to the audience as they are to the writer, and the writer does not back up the claim with enough support.  This fallacy also occurs when the writer introduces an unsupported value judgment.",""
"If [MSK1] is true, then [MSK2] is true. [MSK2] is true. Therefore, [MSK1] is true.","https://www.powerscore.com/lsat/help/lr_flaws.cfm","internal contradiction","Mayor: During my previous term as mayor my staff and I spent a great deal of time focusing on our city’s economy, and unemployment reached an all-time high as a result. So clearly you should support my re-election campaign if you are among those still looking for a job.","This particular mistake, also sometimes called a “self-contradiction,” occurs when an author’s conclusion is actually opposite the conclusion that is best supported by the given premises. ","introduces information that actually contradicts the conclusion"
"If [MSK1] is true, then [MSK2] is true. [MSK2] is true. Therefore, [MSK1] is true.","https://web.archive.org/web/20070625122234/http://leo.stcloudstate.edu/acadwrite/logic.html","affirmation of the consequent","If one is 16 years old or older, one can drive an automobile in Wisconsin.  I saw  your niece driving through Wausau yesterday.  She must be at least 16.","The writer uses an If...then statement in the argument's reasoning.  Then, the writer confirms the then part of the statement and derives the If part, thereby committing a serious logical flaw.",""
"If [MSK1] is true, then [MSK2] is true. [MSK2] is true. Therefore, [MSK1] is true.","https://www.lsat-center.com/prep-guide/argumentative-flaws/","non sequitur","The house is white; therefore it must be big","This means “does not follow,” which indicates that the conclusion does not follow from the premise. "," Just because a house is white doesn’t mean that the house must be big."
"If [MSK1] is true, then [MSK2] is true. [MSK2] is true. Therefore, [MSK1] is true.","https://academicinfluence.com/inflection/influence/logical-fallacies","non-sequitur","People like to walk on the beach. Beaches have sand. We should put sand on the floor in our living room.","Technically, a non sequitur is any invalid argument where a given premise does not logically support the given conclusion. In this way, the phrase non sequitur is practically synonymous with the word fallacy. However, in the context of a discussion on formal fallacies, a non-sequitur is a statement in which the premise has no apparent relationship with the conclusion, and therefore cannot be used to ascertain that this conclusion is true.",""
"If [MSK1] is true, then [MSK2] is true. [MSK2] is true. Therefore, [MSK1] is true.","https://courses.lumenlearning.com/ivytech-engl112/chapter/formal-and-informal-fallacies/","formal fallacy","Premise: All black bears are omnivores. Premise: All raccoons are omnivores. Conclusion: All raccoons are black bears.","Bears are a subset of omnivores. Raccoons also are a subset of omnivores. But these two subsets do not overlap, and that fact makes the conclusion illogical. The argument is invalid—that is, the relationship between the premises doesn’t support the conclusion.",""
"If [MSK1] is true, then [MSK2] is true. [MSK2] is true. Therefore, [MSK1] is true.","https://academicinfluence.com/inflection/influence/logical-fallacies","appeal to probability","It’s possible to pass the class without attending regularly. Therefore, you will pass even if you don’t attend regularly.","The possibiliter ergo probabiliten refers to a fallacy in which one conflates possibility with probability, or in which one conflates probability with certainty. At the heart of this inductive fallacy is the error in presuming that because there is evidence that a thing is possible, one can take for granted either its probability or its certainty.",""
"If [MSK1] is true, then [MSK2] is true. [MSK2] is true. Therefore, [MSK1] is true.","https://academicinfluence.com/inflection/influence/logical-fallacies","appeal to probability","It is possible aliens built the pyramids. Therefore, aliens built the pyramids.","The possibiliter ergo probabiliten refers to a fallacy in which one conflates possibility with probability, or in which one conflates probability with certainty. At the heart of this inductive fallacy is the error in presuming that because there is evidence that a thing is possible, one can take for granted either its probability or its certainty.",""
"If [MSK1] is true, then [MSK2] is true. [MSK2] is true. Therefore, [MSK1] is true.","https://academicinfluence.com/inflection/influence/logical-fallacies","affirming the disjunct","Bruce is American, or he is not from New Jersey. Bruce is not American, therefore, he is not from New Jersey.","In the case of Affirming the Disjunct, also sometimes referred to as the false exclusionary disjunct, it is incorrectly presumed that an “or” condition excludes the possibility that “either/or” could be true. In other words, when a speaker makes a statement indicating “A or B,” the fallacy occurs when the responding speaker assumes “A, therefore, not B.” This is a fallacy of equivocation in which one assumes that because one disjunct is true, the other must be untrue.",""
"If [MSK1] is true, then [MSK2] is true. [MSK2] is true. Therefore, [MSK1] is true.","https://academicinfluence.com/inflection/influence/logical-fallacies","affirming the disjunct","Either God created the world or evolution happened. Evolution happened. Therefore, God did not create the world.","In the case of Affirming the Disjunct, also sometimes referred to as the false exclusionary disjunct, it is incorrectly presumed that an “or” condition excludes the possibility that “either/or” could be true. In other words, when a speaker makes a statement indicating “A or B,” the fallacy occurs when the responding speaker assumes “A, therefore, not B.” This is a fallacy of equivocation in which one assumes that because one disjunct is true, the other must be untrue.",""
"If [MSK1] is true, then [MSK2] is true. [MSK2] is true. Therefore, [MSK1] is true.","https://academicinfluence.com/inflection/influence/logical-fallacies","affirming the disjunct","Gus is Christian or Gus is politically liberal. Gus is a Christian. Therefore, Gus is not politically liberal.","In the case of Affirming the Disjunct, also sometimes referred to as the false exclusionary disjunct, it is incorrectly presumed that an “or” condition excludes the possibility that “either/or” could be true. In other words, when a speaker makes a statement indicating “A or B,” the fallacy occurs when the responding speaker assumes “A, therefore, not B.” This is a fallacy of equivocation in which one assumes that because one disjunct is true, the other must be untrue.",""
"If [MSK1] is true, then [MSK2] is true. [MSK2] is true. Therefore, [MSK1] is true.","https://academicinfluence.com/inflection/influence/logical-fallacies","affirming the consequent","If I’m psychic, I will be able to see dead people. I see dead people, therefore I’m psychic.","I might actually just be insane.",""
"If [MSK1] is true, then [MSK2] is true. [MSK2] is true. Therefore, [MSK1] is true.","https://academicinfluence.com/inflection/influence/logical-fallacies","affirming the consequent","If it was raining outside, it would be dark. It’s dark outside, so it must be raining.","It might be 10PM.",""
"If [MSK1] is true, then [MSK2] is true. [MSK2] is true. Therefore, [MSK1] is true.","https://academicinfluence.com/inflection/influence/logical-fallacies","affirming the consequent","If Hunter was human, he would be mortal. Hunter is mortal. Therefore, Hunter is a human.","Hunter may actually be my cat.",""
"If [MSK1] is true, then [MSK2] is true. [MSK2] is true. Therefore, [MSK1] is true.","https://writingcenter.unc.edu/tips-and-tools/fallacies/","false analogy","“Guns are like hammers—they’re both tools with metal parts that could be used to kill someone. And yet it would be ridiculous to restrict the purchase of hammers—so restrictions on purchasing guns are equally ridiculous.”","While guns and hammers do share certain features, these features (having metal parts, being tools, and being potentially useful for violence) are not the ones at stake in deciding whether to restrict guns. Rather, we restrict guns because they can easily be used to kill large numbers of people at a distance. This is a feature hammers do not share—it would be hard to kill a crowd with a hammer. Thus, the analogy is weak, and so is the argument based on it.",""
"If [MSK1] is true, then [MSK2] is true. [MSK2] is true. Therefore, [MSK1] is true.","https://academicinfluence.com/inflection/influence/logical-fallacies","appeal to probability","It is possible to fake the moon landing through special effects. Therefore, the moon landing was a fake using special effects.","The possibiliter ergo probabiliten refers to a fallacy in which one conflates possibility with probability, or in which one conflates probability with certainty. At the heart of this inductive fallacy is the error in presuming that because there is evidence that a thing is possible, one can take for granted either its probability or its certainty.",""
"If [MSK1] is true, then [MSK2] is true. [MSK2] is true. Therefore, [MSK1] is true.","https://www.logicallyfallacious.com/logicalfallacies/Fallacy-of-Four-Terms","four terms","All cats are felines. All dogs are canines. Therefore, all cats are canines."," When you add in a fourth term to a categorical syllogism that can only have three terms to be logically valid, we get nonsense -- or at least an invalid argument. ",""
"If [MSK1] is true, then [MSK2] is true. [MSK2] is true. Therefore, [MSK1] is true.","https://www.logicallyfallacious.com/logicalfallacies/Denying-the-Antecedent","denying the antecedent","If it barks, it is a dog. It doesn’t bark. Therefore, it’s not a dog."," It is not that clear that a fallacy is being committed, but because this is a formal argument following a strict form, even if the conclusion seems to be true, the argument is still invalid.  This is why fallacies can be very tricky and deceptive.  Since it doesn’t bark, we cannot conclude with certainty that it isn’t a dog -- it could be a dog who just can’t bark. The arguer has committed a formal fallacy, and the argument is invalid because the truth of the premises does not guarantee the truth of the conclusion.",""
"If [MSK1] is true, then [MSK2] is true. [MSK2] is true. Therefore, [MSK1] is true.","https://kspope.com/fallacies/fallacies.php","denying the antecedent","If this test were based on fraudulent norms, then it would be invalid. But the norms are not fraudulent. Therefore, this test is valid.","",""
"If [MSK1] is true, then [MSK2] is true. [MSK2] is true. Therefore, [MSK1] is true.","https://www.logicallyfallacious.com/logicalfallacies/Illicit-Major","illicit major","All hotdogs are fast food. No hamburgers are hotdogs. Therefore, no hamburgers are fast food."," In our example, the major term is “fast food”, because it is the term that appears in the major premise (first premise) as the predicate and in the conclusion.  As such, in this position, it is “undistributed”.",""
"If [MSK1] is true, then [MSK2] is true. [MSK2] is true. Therefore, [MSK1] is true.","https://www.logicallyfallacious.com/logicalfallacies/Illicit-Major","illicit major","All Jim Carrey movies are hilarious. No horror movies are Jim Carrey movies. Therefore, no horror movies are hilarious."," In our example, the major term is “hilarious”, because it is the term that appears in the major premise (first premise) as the predicate and in the conclusion.  As such, in this position, it is “undistributed”.",""
