"updated_label","original_url","old_label","source_article","explanations","rationale"
"[MSK1] is made without evidence. In place of evidence, emotion is used to convince the interlocutor that [MSK1] is true.","https://www.logicallyfallacious.com/logicalfallacies/Appeal-to-Consequences","appeal to consequences","If there is no freewill, then we are not ultimately in control of our actions. If this is true, our entire system of justice would be seriously flawed. This would be very bad; therefore, freewill must exist."," The “freewill” argument has been around for thousands of years, and we may never know how free we really are to make decisions. Many philosophers recognize this problem as well as the consequences of not believing in freewill. For this reason, some suggest that we should just accept freewill as being true. While acting as if we have freewill might lead to a better outcome, actually believing freewill to be true because of the consequences is a compromise of one’s rational integrity.",""
"[MSK1] is made without evidence. In place of evidence, emotion is used to convince the interlocutor that [MSK1] is true.","https://www.logicallyfallacious.com/logicalfallacies/Appeal-to-Consequences","appeal to consequences","If there is no objective morality, then all the bad people will not be punished for their bad behavior after death.  I don’t like that; therefore, morality must be objective."," The fact that one wants to be rewarded, or wants other people to suffer, says nothing to the truth claim of objective morality.  These examples are also begging the question that there is life after death.",""
"[MSK1] is true because of [MSK2]. [MSK2] is true because of [MSK1].","https://www.logicallyfallacious.com/logicalfallacies/Subverted-Support","circular","The reason billions of children starve to death each year is because we live in a world that does not care."," Billions of children don’t starve to death each year -- not even close.  If it were close, it might be better categorized as an exaggeration, but this would be more of an attempt to get the audience to accept the assertion as a fact while focusing more on the reason rather than the assertion itself.",""
"[MSK1] is true because of [MSK2]. [MSK2] is true because of [MSK1].","https://en.wikipedia.org/wiki/List_of_fallacies#References","circular","all bachelors are unmarried males","",""
"[MSK1] is true because of [MSK2]. [MSK2] is true because of [MSK1].","https://en.wikipedia.org/wiki/List_of_fallacies#References","circular","something that kills is deadly","",""
"[MSK1] is true because of [MSK2]. [MSK2] is true because of [MSK1].","https://en.wikipedia.org/wiki/List_of_fallacies#References","circular","smoking cigarettes is deadly because cigarettes can kill you","",""
"[MSK1] is true because of [MSK2]. [MSK2] is true because of [MSK1].","https://www.thoughtco.com/begging-the-question-petitio-principii-250337","circular","What I do know is that if a dirty bomb goes off on Wall Street and the winds are blowing this way, then I and much of this part of Brooklyn are possibly toast. Is that worth possible violations of the rights of some psycho-violent street thug? To me it is.","Al-Muhajir was declared an ""enemy combatant,"" which meant that the government could remove him from civil judicial oversight and no longer had to prove in an impartial court that he was a threat. Of course, incarcerating a person is only a valid means of protecting citizens if that person is, in fact, a threat to people's safety. Thus, the above statement commits the fallacy of Begging the Question because it assumes that al-Muhajir is a threat, exactly the question which is at issue and exactly the question which the government took steps to ensure was not answered.",""
"[MSK1] is true because of [MSK2]. [MSK2] is true because of [MSK1].","https://www.thoughtco.com/begging-the-question-petitio-principii-250337","circular","Free trade will be good for this country. The reason is patently clear. Isn't it obvious that unrestricted commercial relations will bestow on all sections of this nation the benefits which result when there is an unimpeded flow of goods between countries?","The argument presented in this example is a little bit more like the way the fallacy appears typically in reality because most people are smart enough to avoid stating their premises and conclusions in the same manner. In this case, ""unrestricted commercial relations"" is simply a long way of stating ""free trade"" and the rest of what follows that phrase is an even longer way of saying ""good for this country.""",""
"[MSK1] is true because of [MSK2]. [MSK2] is true because of [MSK1].","https://www.thoughtco.com/begging-the-question-petitio-principii-250337","circular","You would think that taxes should be lowered because you are a Republican [and therefore your argument about taxes should be rejected].","",""
"[MSK1] is true because of [MSK2]. [MSK2] is true because of [MSK1].","https://www.thoughtco.com/begging-the-question-petitio-principii-250337","circular","Executions are moral because we must have a death penalty to discourage violent crime.","This might normally be considered an example of a Genetic Fallacy - an ad hominem fallacy which involves the rejection of an idea or argument because of the nature of the person presenting it. And indeed, this is an example of that fallacy, but it is also more.",""
"[MSK1] is true because of [MSK2]. [MSK2] is true because of [MSK1].","https://www.logicallyfallacious.com/logicalfallacies/Subverted-Support","circular","The reason the firmament, a tent-like structure that kept the “waters above” from flooding the earth as described in the Bible, is no longer there today, is because it was destroyed during Noah’s flood.","The reason the firmament isn’t there today is because it never existed.  To attempt to explain it is to get the audience to assume it existed.",""
"[MSK1] is true because of [MSK2]. [MSK2] is true because of [MSK1].","https://www.centrallakesclinic.biz/psychotherapy/begging-the-question-petitio-principii.html","circular","My way of responding to difficult patients is by far the most ethical because no other way is so ethical and it is the only way that is completely ethical.","",""
"[MSK1] is true because of [MSK2]. [MSK2] is true because of [MSK1].","https://www.logicallyfallacious.com/logicalfallacies/Begging-the-Question","circular","The reason everyone wants the new ""Slap Me Silly Elmo"" doll is because this is the hottest toy of the season!"," Everyone wanting the toy is the same thing as it being ""hot,"" so the reason given is no reason at all—it is simply rewording the claim and trying to pass it off as support for the claim.",""
"[MSK1] is true because of [MSK2]. [MSK2] is true because of [MSK1].","https://quizizz.com/admin/quiz/5c052a53f1cae6001ab2d649/easier-logical-fallacy-review","circular; cum hoc ergo propter hoc; single cause","Mr. Casal got sick last week, so it was likely due to the students.","",""
"[MSK1] is true because of [MSK2]. [MSK2] is true because of [MSK1].","https://www.logicallyfallacious.com/logicalfallacies/Circular-Definition","circular","Flippityflu: smarter than a Floppityflip. Floppityflip: dumber than a Flippityflu."," Here we have two definitions that result in a slightly larger circle, but a circle nonetheless.",""
"[MSK1] is true because of [MSK2]. [MSK2] is true because of [MSK1].","https://www.logicallyfallacious.com/logicalfallacies/Circular-Reasoning","circular","Pvt. Joe Bowers: What are these electrolytes? Do you even know? Secretary of State: They're... what they use to make Brawndo! Pvt. Joe Bowers: But why do they use them to make Brawndo? Secretary of Defense: [raises hand after a pause] Because Brawndo's got electrolytes."," This example is from a favorite movie of mine, Idiocracy, where Pvt. Joe Bowers (played by Luke Wilson) is dealing with a bunch of not-very-smart guys from the future.  Joe is not getting any useful information about electrolytes, no matter how hard he tries.",""
"[MSK1] is true because of [MSK2]. [MSK2] is true because of [MSK1].","https://www.logicallyfallacious.com/logicalfallacies/Circular-Reasoning","circular","The Bible is the Word of God because God tells us it is... in the Bible."," This is a very serious circular argument on which many people base their entire lives. The circularity is in the stated or implied claim that the reason they trust in the Bible is because it is the Word of God.  This is like getting an e-mail from a Nigerian prince, offering to give you his billion dollar fortune -- but only after you wire him a “good will” offering of $50,000.  Of course, you are skeptical until you read the final line in the e-mail that reads “I, prince Nubadola, assure you that this is my message, and it is legitimate.  You can trust this e-mail and any others that come from me.”  Now you know it is legitimate... because it says so in the e-mail.",""
"[MSK1] is true because of [MSK2]. [MSK2] is true because of [MSK1].","https://quizizz.com/admin/quiz/5a299094876fa01100a5d10b/logical-fallacy-review","circular; cum hoc ergo propter hoc; single cause","Tik Tok is popular among teens because so many of them use it.","",""
"[MSK1] is true because of [MSK2]. [MSK2] is true because of [MSK1].","https://quizizz.com/admin/quiz/5c052a53f1cae6001ab2d649/easier-logical-fallacy-review","circular; cum hoc ergo propter hoc; single cause","Mr. Casal was very tired because he had no energy.","",""
"[MSK1] is true because of [MSK2]. [MSK2] is true because of [MSK1].","https://quizizz.com/admin/quiz/5c052a53f1cae6001ab2d649/easier-logical-fallacy-review","circular; cum hoc ergo propter hoc; single cause","Nike's are great because they're awesome.","",""
"[MSK1] is true because of [MSK2]. [MSK2] is true because of [MSK1].","https://quizizz.com/admin/quiz/5c052a53f1cae6001ab2d649/easier-logical-fallacy-review","circular; cum hoc ergo propter hoc; single cause","I lost my phone in the living room, so it will always be in the living room when it is lost.","",""
"[MSK1] is true because of [MSK2]. [MSK2] is true because of [MSK1].","https://quizizz.com/admin/quiz/5c052a53f1cae6001ab2d649/easier-logical-fallacy-review","circular; cum hoc ergo propter hoc; single cause","My phone charger is broken because it doesn't work.","",""
"[MSK1] is true because of [MSK2]. [MSK2] is true because of [MSK1].","https://www.logicallyfallacious.com/logicalfallacies/Homunculus-Fallacy","homunculus fallacy","Bert: How do eyes project an image to your brain? Ernie: Think of it as a little guy in your brain watching the movie projected by your eyes. Bert: Ok, but what is happening in the little guy in your head’s brain? Ernie: Well, think of it as a little guy in his brain watching a movie...","This fallacy creates an endless loop that actually explains nothing.  It is fallacious reasoning to accept an explanation that creates this kind of endless loop that lacks any explanatory value.",""
"[MSK1] is true because of [MSK2]. [MSK2] is true because of [MSK1].","https://www.logicallyfallacious.com/logicalfallacies/Homunculus-Fallacy","homunculus fallacy","Dicky: So how do you think life began? Ralphie: Simple.  Aliens from another planet seeded this planet with life billions of years ago. Dicky: OK, but how did that alien life form begin? Ralphie: Simple.  Aliens from another planet seeded that planet with life."," This fallacy can be tricky because maybe it is true that aliens are responsible for spreading life, so the answers might be technically right, but the question implied is how life ultimately began, which this form of reasoning will not answer.",""
"[MSK1] is true because of [MSK2]. [MSK2] is true because of [MSK1].","https://www.thoughtco.com/begging-the-question-petitio-principii-250337","circular","In arguing that abortion is not really a private moral matter, Fr. Frank A. Pavone, National Director Priests for Life, has written that ""Abortion is our problem, and the problem of every human being. We are one human family. Nobody can be neutral on abortion. It involves the destruction of an entire group of human beings!""","This example has a similar problem, but with a different issue. Here, the arguer is assuming that capital punishment serves as any deterrent in the first place. This may be true, but it is at least as questionable as the idea that it is even moral. Because the assumption is unstated and debatable, this argument also begs the question.",""
"[MSK1] is true because of [MSK2]. [MSK2] is true because of [MSK1].","https://www.logicallyfallacious.com/logicalfallacies/Circular-Definition","circular"," Circular definition: a definition that is circular.","The definition is not at all helpful because we used the same words in the term to define them.",""
"[MSK1] is true because of [MSK2]. [MSK2] is true because of [MSK1].","https://www.thoughtco.com/begging-the-question-petitio-principii-250337","circular","Murder is morally wrong. Therefore, abortion is morally wrong.","The argument presumes the truth of a premise that isn't stated: that abortion is murder. As this premise is far from obvious, is closely related to the point in question (is abortion immoral?), and the arguer doesn't bother mentioning it (much less support it), the argument begs the question.",""
"[MSK1] is true because of [MSK2]. [MSK2] is true because of [MSK1].","https://quizizz.com/admin/quiz/5ffdbb6b36ee14001ec3829e/fallacies","circular","Distracting and dangerous mobile devices should be banned from use in vehicles.","",""
"[MSK1] is true because of [MSK2]. [MSK2] is true because of [MSK1].","https://www.thoughtco.com/begging-the-question-petitio-principii-250337","circular","We know God exists because we can see the perfect order of His Creation, an order which demonstrates supernatural intelligence in its design.","This is a common religious argument which begs the question in a slightly more subtle way. The conclusion, God exists, is based upon the premise that we can see intelligent design in the universe. But the existence of intelligent design itself assumes the existence of a designer - that is to say, a god. A person making such an argument must defend this premise before the argument can have any force.",""
"[MSK1] is true because of [MSK2]. [MSK2] is true because of [MSK1].","https://quizizz.com/admin/quiz/5ad4e7ecdc7f09001a7e8c79/logical-fallacies","circular","President Bennett is an effective communicator, because he has a natural talent for speaking with people.","",""
"[MSK1] is true because of [MSK2]. [MSK2] is true because of [MSK1].","https://quizizz.com/admin/quiz/5ad4e7ecdc7f09001a7e8c79/logical-fallacies","circular","Pamela never lies. She told me herself, so it must be true.","",""
"[MSK1] is true because of [MSK2]. [MSK2] is true because of [MSK1].","https://quizizz.com/admin/quiz/60548cc5a25098001b13f9f8/logical-fallacies","circular","“Harold’s new book is well-written because Harold is a wonderful writer.”","",""
"[MSK1] is true because of [MSK2]. [MSK2] is true because of [MSK1].","https://quizizz.com/admin/quiz/609924bc4c22dd001bc0b177/claims-counterclaims-fallacies","circular","The number of pirates in existence decreased as the global average temperature rose. Therefore, we can conclude that hotter weather reduces piracy.","",""
"[MSK1] is true because of [MSK2]. [MSK2] is true because of [MSK1].","https://quizizz.com/admin/quiz/5c6cbd74936b92001a45521b/logical-fallacies","circular","""When my parents talk to me about how important it is to learn a second language, I remind them they didn't learn another language.","",""
"[MSK1] is true because of [MSK2]. [MSK2] is true because of [MSK1].","https://quizizz.com/admin/quiz/6059f970a5d7c3001da9d533/logical-fallacies","circular","Senator Randall isn't lying when she says she cares about her constituents—she wouldn't lie to people she cares about.","",""
"[MSK1] is true because of [MSK2]. [MSK2] is true because of [MSK1].","https://quizizz.com/admin/quiz/6059f970a5d7c3001da9d533/logical-fallacies","circular","Free speech is good not just for the individual, but for all of society. After all, it's in the interest of the community that everyone should be at liberty to express his or her beliefs.","",""
"[MSK1] is true because of [MSK2]. [MSK2] is true because of [MSK1].","https://quizizz.com/admin/quiz/6059f970a5d7c3001da9d533/logical-fallacies","circular","Companies that make huge profits must be exploiting their customers because the only way a company could make large profits is by taking advantage of their customers.","",""
"[MSK1] is true because of [MSK2]. [MSK2] is true because of [MSK1].","https://quizizz.com/admin/quiz/5fa59387abc53e001b67ecbc/logical-fallacies","circular","You must obey the law, because it’s illegal to break the law.","",""
"[MSK1] is true because of [MSK2]. [MSK2] is true because of [MSK1].","https://quizizz.com/admin/quiz/5fa59387abc53e001b67ecbc/logical-fallacies","circular","You have to invite Jenna to your party because it would not be nice not to invite Jenna.","",""
"[MSK1] is true because of [MSK2]. [MSK2] is true because of [MSK1].","https://quizizz.com/admin/quiz/5fe94858a0463a001b61cfcc/logical-fallacies","circular","1. “iPhones are the best smartphones on the market because Apple makes the best smartphones.”","",""
"[MSK1] is true because of [MSK2]. [MSK2] is true because of [MSK1].","https://quizizz.com/admin/quiz/5fe94858a0463a001b61cfcc/logical-fallacies","circular","“I know that what I experience is real because I can see, hear, smell, touch and taste everything.”","",""
"[MSK1] is true because of [MSK2]. [MSK2] is true because of [MSK1].","https://quizizz.com/admin/quiz/5fd38f9d790f6c001b94a240/logical-fallacies","circular","""I am a great leader because I make great leadership decisions. The proof that I make great leadership decisions is that I am a great leader, and that's what leaders do."" What is this?","",""
"[MSK1] is true because of [MSK2]. [MSK2] is true because of [MSK1].","https://quizizz.com/admin/quiz/5e3d6e7a8d479c001bcdfe4d/logical-fallacies-rhetorical-devices","circular","That restaurant is popular because everyone in town goes there.","",""
"[MSK1] is true because of [MSK2]. [MSK2] is true because of [MSK1].","https://quizizz.com/admin/quiz/5f27887aab7ffa001b391645/logical-appeals-fallacies","circular","You can't give me a C! I'm an A student, a C is just wrong!","",""
"[MSK1] is true because of [MSK2]. [MSK2] is true because of [MSK1].","https://quizizz.com/admin/quiz/5e208950881f96001b246eab/logical-fallacies","circular","Violent video games cause teens to be violent, because violent teens play violent video games.","",""
"[MSK1] is true because of [MSK2]. [MSK2] is true because of [MSK1].","https://quizizz.com/admin/quiz/602f2741339967001ca8a849/fallacies-of-arguments-based-on-reason","circular","""I have a right to free speech so I can say what I want and you shouldn't try to stop me. ""","",""
"[MSK1] is true because of [MSK2]. [MSK2] is true because of [MSK1].","https://quizizz.com/admin/quiz/604262ba8a546c001b3112ac/argumentative-and-logical-fallacies","circular","John Green is a wonderful writer because he writes so well.","",""
"[MSK1] is true because of [MSK2]. [MSK2] is true because of [MSK1].","https://quizizz.com/admin/quiz/60c66e403fb5ff001bc8192e/logical-fallacies-part","circular","Why should we put people on trial when we know they are guilty?","",""
"[MSK1] is true because of [MSK2]. [MSK2] is true because of [MSK1].","https://quizizz.com/admin/quiz/5a9d7720b3079e00192c084e/fallacies","circular","Sleeping until noon is the worst thing to do because it is bad to sleep late.","",""
"[MSK1] is true because of [MSK2]. [MSK2] is true because of [MSK1].","https://quizizz.com/admin/quiz/5db2bfe7c071cc001c22208b/logical-fallacies","circular","""The Philippines is in poverty because of poor people.""","",""
"[MSK1] is true because of [MSK2]. [MSK2] is true because of [MSK1].","https://quizizz.com/admin/quiz/60560434e10317001e4ec2f4/logical-fallacies","circular","Order is necessary to justice because justice can only be achieved by a program of social and legal order.","",""
"[MSK1] is true because of [MSK2]. [MSK2] is true because of [MSK1].","https://quizizz.com/admin/quiz/5e822728fb03dd001ba9419b/logical-fallacies-part-one","circular","the reason why more people are leaving this country is because of economic problems, therefore because there is an economic problem is that people are leaving this country.","",""
"[MSK1] is true because of [MSK2]. [MSK2] is true because of [MSK1].","https://quizizz.com/admin/quiz/5fd79a1feb9b65001b6de52a/ap-q-rhetorical-fallacies","circular","I have a right to free speech so I can say what I want and you shouldn't try to stop me","",""
"[MSK1] is true because of [MSK2]. [MSK2] is true because of [MSK1].","https://quizizz.com/admin/quiz/6012e5d77b0272001eadb40d/rhetorical-fallacies","circular","Starbucks is the best because it's expensive.","",""
"[MSK1] is true because of [MSK2]. [MSK2] is true because of [MSK1].","https://www.thoughtco.com/begging-the-question-petitio-principii-250337","circular","After years of ignoring God, people have a hard time realizing what is right and what is wrong, what is good and what is bad.","In arguing that nonbelievers are not as moral as believers, it is assumed that a god exists and, more importantly, that a god is necessary for, or even relevant to, the establishment of norms of right and wrong. Because these assumptions are critical to the discussion at hand, the arguer is begging the question.",""
"[MSK1] is true because of [MSK2]. [MSK2] is true because of [MSK1].","https://quizizz.com/admin/quiz/5e528b7fe6cfb3001ca07fd8/mankind-s-next-giant-leap","circular","I shouldn't have flunked the test because I never get F's","",""
"[MSK1] is true because of [MSK2]. [MSK2] is true because of [MSK1].","https://quizizz.com/admin/quiz/5e418ae90e0c7d001b8749e9/logical-fallacy","circular","Americans should give money to charity because it is the right thing to do.","",""
"[MSK1] is true because of [MSK2]. [MSK2] is true because of [MSK1].","https://quizizz.com/admin/quiz/5cb0c70b48b73f001a2f710e/persuasive-unit-quiz-review","circular","We know he’s not lying since he says he’s telling the truth.","",""
"[MSK1] is true because of [MSK2]. [MSK2] is true because of [MSK1].","https://quizizz.com/admin/quiz/5ba47346e4fc100019e0c6da/logical-fallacy-examples","circular","How do I know that Beth is the most intelligent person in our geometry class? I know because she's so smart.","",""
"[MSK1] is true because of [MSK2]. [MSK2] is true because of [MSK1].","https://quizizz.com/admin/quiz/6052ef81fd93a6001d44b2fa/logical-fallacies-and-public-speaking","circular","Ghosts exist.... because I saw a ghost in my closet","",""
"[MSK1] is true because of [MSK2]. [MSK2] is true because of [MSK1].","https://quizizz.com/admin/quiz/603f9f9db56df1001b02cfc7/logical-fallacies-daniella-a","circular","Fast food is bad for you because is junk.","",""
"[MSK1] is true because of [MSK2]. [MSK2] is true because of [MSK1].","https://quizizz.com/admin/quiz/5da783b3216605001ad267df/match-logical-fallacies","circular","Cell phones stop students from concentrating in class because they are distracting.","",""
"[MSK1] is true because of [MSK2]. [MSK2] is true because of [MSK1].","https://fallacyinlogic.com/circular-reasoning/","circular reasoning","“It’s important to argue logically because logic is an essential part of argumentation.”","Circular reasoning occurs when someone makes an argument in which both the premises and the conclusion have to rely on the truthfulness of the other.",""
"[MSK1] is true because of [MSK2]. [MSK2] is true because of [MSK1].","https://fallacyinlogic.com/circular-reasoning/","circular reasoning","“You should always do what you are being told because following the rules is important.”","Circular reasoning occurs when someone makes an argument in which both the premises and the conclusion have to rely on the truthfulness of the other.",""
"[MSK1] is true because of [MSK2]. [MSK2] is true because of [MSK1].","https://fallacyinlogic.com/circular-reasoning/","circular reasoning","“The best minds in physics have studied physics most of their lives, as it’s necessary to study physics extensively to become a top physicist.”","Circular reasoning occurs when someone makes an argument in which both the premises and the conclusion have to rely on the truthfulness of the other.",""
"[MSK1] is true because of [MSK2]. [MSK2] is true because of [MSK1].","https://courses.lumenlearning.com/englishcomp1/chapter/common-logical-fallacies/","begging the question","This legislation is sinful because it is the wrong thing to do.","",""
"[MSK1] is true because of [MSK2]. [MSK2] is true because of [MSK1].","https://thebestschools.org/magazine/15-logical-fallacies-know/","circular argument","According to my brain, my brain is reliable.","Circular arguments often use a claim as both a premise and a conclusion. This fallacy only appears to be an argument when in fact it's just restating one's assumptions.",""
"[MSK1] is true because of [MSK2]. [MSK2] is true because of [MSK1].","https://thebestschools.org/magazine/15-logical-fallacies-know/","circular argument","Smoking pot is against the law because it's wrong; I know it's wrong because it is against the law.","Circular arguments occur when a person's argument repeats what they already assumed before without arriving at a new conclusion.",""
"[MSK1] is true because of [MSK2]. [MSK2] is true because of [MSK1].","https://web.archive.org/web/20070625122234/http://leo.stcloudstate.edu/acadwrite/logic.html","circular","God exists because the Bible says so. The Bible is a reliable source because it is the  word of God.","The writer defends the claim by using the conclusion as one of the premises to support the conclusion.",""
