"updated_label","original_url","old_label","source_article","explanations","rationale"
"[MSK1] makes claim [MSK2]. [MSK3] restates [MSK2] (in a distorted way). [MSK3] attacks the distorted version of [MSK2]. Therefore, [MSK2] is false.","https://www.proprofs.com/quiz-school/quizreport.php?title=logical-fallacies-quiz&sid=270424462","straw man","Animal rights activists believe that we shouldn't keep animals captive and make them do our will. They would have you abandon your pets in the wilderness.","The Straw Man is when you set up the opposing side to look unreasonable by misrepresenting what they actually stand for.",""
"[MSK1] makes claim [MSK2]. [MSK3] restates [MSK2] (in a distorted way). [MSK3] attacks the distorted version of [MSK2]. Therefore, [MSK2] is false.","https://www.proprofs.com/quiz-school/quizreport.php?title=logical-fallacies_9&sid=270424982","straw man","Prof. Jones: ""The university just cut our yearly budget by $10,000."" Prof. Smith: ""What are we going to do?"" Prof. Brown: ""I think we should eliminate one of the teaching assistant positions. That would take care of it."" Prof. Jones: ""We could reduce our scheduled raises instead."" Prof. Brown: "" I can't understand why you want to bleed us dry like that, Jones.""","",""
"[MSK1] makes claim [MSK2]. [MSK3] restates [MSK2] (in a distorted way). [MSK3] attacks the distorted version of [MSK2]. Therefore, [MSK2] is false.","https://www.logicallyfallacious.com/logicalfallacies/Strawman-Fallacy","straw man","Zebedee: What is your view on the Christian God? Mike: I don’t believe in any gods, including the Christian one. Zebedee: So you think that we are here by accident, and all this design in nature is pure chance, and the universe just created itself? Mike: You got all that from me stating that I just don’t believe in any gods?","Mike made one claim: that he does not believe in any gods.  From that, we can deduce a few things, like he is not a theist, he is not a practicing Christian, Catholic, Jew, or a member of any other religion that requires the belief in a god, but we cannot deduce that he believes we are all here by accident, nature is chance, and the universe created itself.  Mike might have no beliefs about these things whatsoever.  Perhaps he distinguishes between “accident” and natural selection, perhaps he thinks the concept of design is something we model after the universe, perhaps he has some detailed explanation based on known physics as to how the universe might have first appeared, or perhaps he believes in some other supernatural explanation.  Regardless, this was a gross mischaracterization of Mike’s argument.",""
"[MSK1] makes claim [MSK2]. [MSK3] restates [MSK2] (in a distorted way). [MSK3] attacks the distorted version of [MSK2]. Therefore, [MSK2] is false.","https://quizizz.com/admin/quiz/5e6258fe944a37001b6faae2/logical-fallacies","straw man","""Florida is the most important state because it has sun and beaches.""","",""
"[MSK1] makes claim [MSK2]. [MSK3] restates [MSK2] (in a distorted way). [MSK3] attacks the distorted version of [MSK2]. Therefore, [MSK2] is false.","https://quizizz.com/admin/quiz/5f769795899c3f001cce9a5a/philo-quiz-week-fallacy","straw man","After Jhon said that we should put more money into health and education, Warren responded by saying that he was surprised that Jhon hates our country so much that he wants to leave it defenseless by cutting military spending.","",""
"[MSK1] makes claim [MSK2]. [MSK3] restates [MSK2] (in a distorted way). [MSK3] attacks the distorted version of [MSK2]. Therefore, [MSK2] is false.","https://quizizz.com/admin/quiz/5955a3f0181ab41000ac5a83/debate-fallacies","straw man","Thomas: ""Dating apps are an effective way to meet potential dates. With people's busy work schedules nowadays, technology can help you make connections."" Nina: ""Dating apps are dangerous! Most people are catfished, and guys usually pretend to be so much better than they really are online. If we're so busy, we won't have time for any of that, anyway.""","",""
"[MSK1] makes claim [MSK2]. [MSK3] restates [MSK2] (in a distorted way). [MSK3] attacks the distorted version of [MSK2]. Therefore, [MSK2] is false.","https://quizizz.com/admin/quiz/6024766901d0c1001b04761f/logical-fallacies-practice","straw man","Biology teacher: The theory of evolution states that all species evolve, even humans. Student: I can't accept that humans came from bugs.","",""
"[MSK1] makes claim [MSK2]. [MSK3] restates [MSK2] (in a distorted way). [MSK3] attacks the distorted version of [MSK2]. Therefore, [MSK2] is false.","https://quizizz.com/admin/quiz/5e39b6dee4b2eb001b316c4d/name-that-logical-fallacy","straw man","A speaker chooses a deliberately poor or oversimplified example in order to ridicule and refute an idea","",""
"[MSK1] makes claim [MSK2]. [MSK3] restates [MSK2] (in a distorted way). [MSK3] attacks the distorted version of [MSK2]. Therefore, [MSK2] is false.","https://quizizz.com/admin/quiz/6012e5d77b0272001eadb40d/rhetorical-fallacies","straw man","People who drive big cars probably hate the environment.","",""
"[MSK1] makes claim [MSK2]. [MSK3] restates [MSK2] (in a distorted way). [MSK3] attacks the distorted version of [MSK2]. Therefore, [MSK2] is false.","https://quizizz.com/admin/quiz/5f91a8f01eb916001c015110/rhetorical-fallacies","straw man","Robot 2 (Blue) has been refuting all of Robot 1's (Orange) arguments. Robot 1 launches the above counterargument.","",""
"[MSK1] makes claim [MSK2]. [MSK3] restates [MSK2] (in a distorted way). [MSK3] attacks the distorted version of [MSK2]. Therefore, [MSK2] is false.","https://quizizz.com/admin/quiz/5955a3f0181ab41000ac5a83/debate-fallacies","straw man","Consider the following exchange: Omar: I think capital punishment is a necessary component of our justice system and should remain legal. Kayla: So you are saying that murder should be legal and it is okay for us to go around killing people just because we think they deserve it? That isn't right.","",""
"[MSK1] makes claim [MSK2]. [MSK3] restates [MSK2] (in a distorted way). [MSK3] attacks the distorted version of [MSK2]. Therefore, [MSK2] is false.","https://quizizz.com/admin/quiz/5ffdbb6b36ee14001ec3829e/fallacies","straw man","Person A: I think pollution from humans contributes to climate change. Person B: So, you think humans are directly responsible for extreme weather, like hurricanes, and have caused the droughts in the southwestern U.S.?","",""
"[MSK1] makes claim [MSK2]. [MSK3] restates [MSK2] (in a distorted way). [MSK3] attacks the distorted version of [MSK2]. Therefore, [MSK2] is false.","https://quizizz.com/admin/quiz/5e0cf2291dd028001cf54350/persuasive-terms","straw man","occurs when your opponent over-simplifies or misrepresents your argument (i.e., setting up a ""straw man"") to make it easier to attack or refute","",""
"[MSK1] makes claim [MSK2]. [MSK3] restates [MSK2] (in a distorted way). [MSK3] attacks the distorted version of [MSK2]. Therefore, [MSK2] is false.","https://quizizz.com/admin/quiz/600ad9c66f3c24001bed0f7f/english-review","straw man","A: I don't want to visit McDonald's today. B: So you're just against good food then?","",""
"[MSK1] makes claim [MSK2]. [MSK3] restates [MSK2] (in a distorted way). [MSK3] attacks the distorted version of [MSK2]. Therefore, [MSK2] is false.","https://quizizz.com/admin/quiz/5c1a3f3fe07aa9001ed26cb9/cws-unit-three-introduction","straw man","Like many issues in the world, what seems to be the biggest ISSUE among the Climate Change DEBATE?","",""
"[MSK1] makes claim [MSK2]. [MSK3] restates [MSK2] (in a distorted way). [MSK3] attacks the distorted version of [MSK2]. Therefore, [MSK2] is false.","https://quizizz.com/admin/quiz/5db978973e3b40001ac3ffe3/persuasive-techniques-practice","straw man","Bob Jones is a monster who likes to separate immigrant families in detention centers. How could you vote for someone like that??","",""
"[MSK1] makes claim [MSK2]. [MSK3] restates [MSK2] (in a distorted way). [MSK3] attacks the distorted version of [MSK2]. Therefore, [MSK2] is false.","https://quizizz.com/admin/quiz/5db978973e3b40001ac3ffe3/persuasive-techniques-practice","straw man","This is when you characterize someone with one extreme trait in order to more effectively tear them down.","",""
"[MSK1] makes claim [MSK2]. [MSK3] restates [MSK2] (in a distorted way). [MSK3] attacks the distorted version of [MSK2]. Therefore, [MSK2] is false.","https://quizizz.com/admin/quiz/5f6c215473a960001b4b0054/philosophy-ct-unit-mc-practice","straw man","You see someone walking their dog. The dog goes to the bathroom on a lawn but they don’t pick up after their dog. You ask them to clean up after their dog, but they say, “why do you hate dogs?”","",""
"[MSK1] makes claim [MSK2]. [MSK3] restates [MSK2] (in a distorted way). [MSK3] attacks the distorted version of [MSK2]. Therefore, [MSK2] is false.","https://quizizz.com/admin/quiz/610b247eaba1ad001c963c21/detective-fallacy","straw man","Mr. Stark's idea for implementing affirmative action in the university's admission process is complete folly. He say's he wants the student body to represent diversity in the community. But that's ridiculous. I suppose this means we'll have to throw out our academic standards while were at it. After all, if we're going to let students into our prestigious institution just because of their gender or the color of their skin, then what's going to happen to our reputation?","",""
"[MSK1] makes claim [MSK2]. [MSK3] restates [MSK2] (in a distorted way). [MSK3] attacks the distorted version of [MSK2]. Therefore, [MSK2] is false.","https://quizizz.com/admin/quiz/5e418ae90e0c7d001b8749e9/logical-fallacy","straw man","Students tell Ms. Higgins her hair color looks different on her. Ms. Higgins can't believe her students called ugly and horrendous to look at.","",""
"[MSK1] makes claim [MSK2]. [MSK3] restates [MSK2] (in a distorted way). [MSK3] attacks the distorted version of [MSK2]. Therefore, [MSK2] is false.","https://quizizz.com/admin/quiz/600d4c2859f040001b7e02a1/defends-a-stand-on-an-issue-by-presenting-reasonable-argumen","straw man","Death penalty will not scare criminals because they don’t expect to be caught","",""
"[MSK1] makes claim [MSK2]. [MSK3] restates [MSK2] (in a distorted way). [MSK3] attacks the distorted version of [MSK2]. Therefore, [MSK2] is false.","https://quizizz.com/admin/quiz/5da73748e438d4001afb00fe/logical-fallacy","straw man","If you don't drive a car, you hate the Earth.","",""
"[MSK1] makes claim [MSK2]. [MSK3] restates [MSK2] (in a distorted way). [MSK3] attacks the distorted version of [MSK2]. Therefore, [MSK2] is false.","https://quizizz.com/admin/quiz/604934d7fe8205001fe46ba0/fallacies-quiz","straw man","Senator Smith says that the nation should not add to the defense budget. Senator Jones says that he cannot believe that Senator Smith wants to leave the nation defenseless.","",""
"[MSK1] makes claim [MSK2]. [MSK3] restates [MSK2] (in a distorted way). [MSK3] attacks the distorted version of [MSK2]. Therefore, [MSK2] is false.","https://quizizz.com/admin/quiz/5d8b58e02e4e1c001a5023ab/fallacies","straw man","Student tells his professor that he thinks some of Donald Trump's positions have merit. Professor says he can't believe that the student believes in support racism.","",""
"[MSK1] makes claim [MSK2]. [MSK3] restates [MSK2] (in a distorted way). [MSK3] attacks the distorted version of [MSK2]. Therefore, [MSK2] is false.","https://quizizz.com/admin/quiz/5da73748e438d4001afb00fe/logical-fallacy","straw man","If you don't have a recycling bin you hate the earth and don't care about pollution.","",""
"[MSK1] makes claim [MSK2]. [MSK3] restates [MSK2] (in a distorted way). [MSK3] attacks the distorted version of [MSK2]. Therefore, [MSK2] is false.","https://quizizz.com/admin/quiz/60c66e403fb5ff001bc8192e/logical-fallacies-part","straw man","John: I think we should hire someone to redesign our website. Lola: You're saying we should throw our money away on external resources instead of building up our in-house design team? That's going to hurt our company in the long run.","",""
"If [MSK1] is true, then [MSK2] is true. [MSK2] is true. Therefore, [MSK1] is true.","https://www.logicallyfallacious.com/logicalfallacies/Existential-Fallacy","existential fallacy","All forest creatures live in the woods. All leprechauns are forest creatures. Therefore, some leprechauns live in the woods."," In both examples, the fallacy is committed because we have two universal premises and a particular conclusion, but our example #1 conclusion makes sense, no?  Just because the conclusion might be true, does not mean the logic used to produce it, was valid.  This is how tests like SAT’s and GRE’s screw us over and, technically, in the above example, all babysitter club members have pimples, not just some. Now, look at the second example.  Same form, but when we use classes that obviously (to most people) have no members (leprechauns), we can see that it results in a conclusion that is false. ",""
"If [MSK1] is true, then [MSK2] is true. [MSK2] is true. Therefore, [MSK1] is true.","https://www.logicallyfallacious.com/logicalfallacies/Negative-Conclusion-from-Affirmative-Premises","negative conclusion from affirmative premises","All cats are animals. Some pets are cats. Therefore, some pets are not animals."," The conclusion might be true -- I had a pet rock growing up, but the argument still does not logically support that.  Think of sets and subsets.  All cats are animals",""
"If [MSK1] is true, then [MSK2] is true. [MSK2] is true. Therefore, [MSK1] is true.","https://examples.yourdictionary.com/examples-of-logical-fallacy.htmll","weak analogy","You let my sister pierce her ears when she was 11, so you should let me stay up until midnight.","employs analogies between things that are not really alike",""
"If [MSK1] is true, then [MSK2] is true. [MSK2] is true. Therefore, [MSK1] is true.","https://www.logicallyfallacious.com/logicalfallacies/Negative-Conclusion-from-Affirmative-Premises","negative conclusion from affirmative premises","All boys are sports fans. Some bakers are boys. Therefore, some bakers are not sports fans."," The conclusion might be true -- but the argument still does not logically support that for the same reasons in the first example.  This argument is invalid, thus as a formal argument, it is fallacious.",""
"If [MSK1] is true, then [MSK2] is true. [MSK2] is true. Therefore, [MSK1] is true.","https://www.logicallyfallacious.com/logicalfallacies/Affirming-a-Disjunct","affirming a disjunct","I can’t stop eating these chocolates.  I really love chocolate, or I seriously lack willpower.  I know I really love chocolate; therefore, I cannot lack willpower."," Ignoring the possible false dilemma, the fact that one really loves chocolate does not automatically exclude the other possibility of lacking willpower.",""
"If [MSK1] is true, then [MSK2] is true. [MSK2] is true. Therefore, [MSK1] is true.","https://courses.lumenlearning.com/ivytech-engl112/chapter/formal-and-informal-fallacies/","Premise: All black bears are omnivores. Premise: All raccoons are omnivores. Conclusion: All raccoons are black bears.","Bears are a subset of omnivores. Raccoons also are a subset of omnivores. But these two subsets do not overlap, and that fact makes the conclusion illogical. The argument is invalid—that is, the relationship between the premises doesn’t support the conclusion.","",""
"If [MSK1] is true, then [MSK2] is true. [MSK2] is true. Therefore, [MSK1] is true.","https://www.svcc.edu/academics/pass/ela/overview-documents/5-logical-fallacies.pdf","Putting teenagers in sex-education classes is like taking an alcoholic to a bar.","(Are the things being compared even similar? Does that prove anything?)","",""
"If [MSK1] is true, then [MSK2] is true. [MSK2] is true. Therefore, [MSK1] is true.","https://www.logicallyfallacious.com/logicalfallacies/Affirmative-Conclusion-from-a-Negative-Premise","affirmative conclusion from a negative premise","No donkeys are fish. Some asses are donkeys. Therefore, some asses are fish."," This is a categorical syllogism where we have a single negative premise (i.e., “no donkeys”), and we are attempting to draw a positive (affirmative) conclusion (i.e., “some asses”). On a somewhat related note, some lawyers are asses.",""
"If [MSK1] is true, then [MSK2] is true. [MSK2] is true. Therefore, [MSK1] is true.","https://www.logicallyfallacious.com/logicalfallacies/Exclusive-Premises","exclusive premises","No kangaroos are MMA fighters. Some MMA fighters are not Mormons. Therefore, some Mormons are not kangaroos.","",""
"If [MSK1] is true, then [MSK2] is true. [MSK2] is true. Therefore, [MSK1] is true.","https://www.logicallyfallacious.com/logicalfallacies/Exclusive-Premises","exclusive premises","No animals are insects. No insects are dogs. Therefore, no dogs are animals.","Remember why fallacies are so dangerous",""
"If [MSK1] is true, then [MSK2] is true. [MSK2] is true. Therefore, [MSK1] is true.","https://www.logicallyfallacious.com/logicalfallacies/Kettle-Logic","kettle logic","In an example used by Sigmund Freud in The Interpretation of Dreams, a man accused by his neighbor of having returned a kettle in a damaged condition offered three arguments: That he had returned the kettle undamaged; That it was already damaged when he borrowed it; That he had never borrowed it in the first place."," Each statement contradicts the one before. If it was already damaged, how did he return it undamaged? If he never borrowed it, how was it already damaged when he borrowed it?",""
"If [MSK1] is true, then [MSK2] is true. [MSK2] is true. Therefore, [MSK1] is true.","https://www.logicallyfallacious.com/logicalfallacies/Kettle-Logic","kettle logic","I don't believe in God. One reason is that I think he is evil. And by the way, there is no such thing as ""evil;"" it is just our evaluation of what we believe is wrong."," There are multiple statements here that all contradict, stemmed from the idea that the person does not believe in God. If he or she does not believe in God, how can he or she think God is evil? And if there is no such thing as evil, how can something be evil?",""
"If [MSK1] is true, then [MSK2] is true. [MSK2] is true. Therefore, [MSK1] is true.","https://www.logicallyfallacious.com/logicalfallacies/Affirmative-Conclusion-from-a-Negative-Premise","affirmative conclusion from a negative premise","No people under the age of 66 are senior citizens. No senior citizens are children. Therefore, all people under the age of 66 are children."," In this case, the conclusion is obviously counterfactual although both premises are true.  Why?  Because this is a categorical syllogism where we have one or more negative premises (i.e., “no people...” and “no senior citizens...”), and we are attempting to draw a positive (affirmative) conclusion (i.e., “all people...”). ",""
"If [MSK1] is true, then [MSK2] is true. [MSK2] is true. Therefore, [MSK1] is true.","https://www.logicallyfallacious.com/logicalfallacies/Affirming-the-Consequent","affirming the consequent","If it’s brown, flush it down. I flushed it down. Therefore, it was brown."," No!  I did not have to follow the, “if it’s yellow, let it mellow” rule -- in fact, if I did follow that rule I would probably still be single.  The stated rule is simply, “if it’s brown” (the antecedent), then (implied), “flush it down” (the consequent).  From this, we cannot imply that we can ONLY flush it down if it is brown.  That is a mistake -- a logical fallacy.",""
"If [MSK1] is true, then [MSK2] is true. [MSK2] is true. Therefore, [MSK1] is true.","https://quizizz.com/admin/quiz/5a785356c0a53f001fa6b5a1/logical-fallacies","false analogy","""That's why, under my plan, individuals will be required to carry basic health insurance -- just as most states require you to carry auto insurance. Likewise, businesses will be required to either offer their workers health care, or chip in to help cover the cost of their workers."" President Obama on Universal Health Coverage (some feel that health insurance and car insurance are different on many fundamental aspects, and this is a bad comparison)","",""
"If [MSK1] is true, then [MSK2] is true. [MSK2] is true. Therefore, [MSK1] is true.","https://www.thoughtco.com/what-is-a-converse-error-3126461","affirming the consequent","If Joe robbed a bank then he has a million dollars. Joe has a million dollars, so Joe robbed a bank.","",""
"If [MSK1] is true, then [MSK2] is true. [MSK2] is true. Therefore, [MSK1] is true.","https://quizizz.com/admin/quiz/580e34f556bd584f78ecbb48/logical-fallacies","false analogy","Smoking cigarettes is just like ingesting arsenic into your system; both have been shown to be causally related to death. If you wouldn't want to take a spoonful of arsenic, I would think that you wouldn't want to continue smoking.","",""
"If [MSK1] is true, then [MSK2] is true. [MSK2] is true. Therefore, [MSK1] is true.","https://quizizz.com/admin/quiz/5aa8942d5ae5a90019188726/fallacies","false analogy","A cloud is 90 percent water; a watermelon is 90 percent water. Therefore, since a plane can fly through a cloud, a plane can fly through a watermelon.","",""
"If [MSK1] is true, then [MSK2] is true. [MSK2] is true. Therefore, [MSK1] is true.","https://quizizz.com/admin/quiz/5aa8942d5ae5a90019188726/fallacies","false analogy","Since a single human cell becomes a grown man over a period of a few years, then surely it can't be impossible for a single-cell organism to become the human race over a period of several million years.","",""
"If [MSK1] is true, then [MSK2] is true. [MSK2] is true. Therefore, [MSK1] is true.","https://quizizz.com/admin/quiz/5a71115d28be22001ce11b57/logical-fallacy-practice","false analogy","The book Investing for Dummies really helped me understand my finances better. The book Chess for Dummies was written by the same author, was published by the same press, and costs about the same amount, so it would probably help me understand my finances as well.","",""
"If [MSK1] is true, then [MSK2] is true. [MSK2] is true. Therefore, [MSK1] is true.","https://quizizz.com/admin/quiz/5df2adeda8bd46001b14dac3/logical-fallacy-quiz","false analogy","Not tipping your waiter is like stealing money right out of someone's wallet.","",""
"If [MSK1] is true, then [MSK2] is true. [MSK2] is true. Therefore, [MSK1] is true.","https://quizizz.com/admin/quiz/5e455f8951693e001c452406/fallacies-of-argument-ch","false analogy","""Politicians and diapers must be changed often, and for the same reason.""","",""
"If [MSK1] is true, then [MSK2] is true. [MSK2] is true. Therefore, [MSK1] is true.","https://quizizz.com/admin/quiz/5fac75e5dc466f001c2cbeeb/logical-fallacies","false analogy","You passed everyone in the class, so I should get extra credit","",""
"If [MSK1] is true, then [MSK2] is true. [MSK2] is true. Therefore, [MSK1] is true.","https://quizizz.com/admin/quiz/600a16eae0ec11001c2283fb/logical-fallacies-practice","false analogy","Asking students to sit in the same class for 2 hours is like asking them to wander the desert alone, with no water, for a week.","",""
"If [MSK1] is true, then [MSK2] is true. [MSK2] is true. Therefore, [MSK1] is true.","https://quizizz.com/admin/quiz/5db2bfe7c071cc001c22208b/logical-fallacies","false analogy","I believe that PNoy is the Abraham Lincoln of the Philippines.","",""
"If [MSK1] is true, then [MSK2] is true. [MSK2] is true. Therefore, [MSK1] is true.","https://quizizz.com/admin/quiz/602f2741339967001ca8a849/fallacies-of-arguments-based-on-reason","false analogy","""Cars cause more deaths than firearms do, so if we ban firearms we should also ban cars.""","",""
"If [MSK1] is true, then [MSK2] is true. [MSK2] is true. Therefore, [MSK1] is true.","https://quizizz.com/admin/quiz/5f9c63e4f397fd001e86a26a/logical-fallacies-check","false analogy","Schools are like families; therefore teachers (like parents) should be allowed to discipline their students.","",""
"If [MSK1] is true, then [MSK2] is true. [MSK2] is true. Therefore, [MSK1] is true.","https://quizizz.com/admin/quiz/5e51cbba17bc4d001c561614/group-logical-fallacies","false analogy","""Just like students are given a couple of weeks of preparation before taking exams, doctors should also be given few days or weeks to prepare themselves before an operation or surgery, after all surgery is not as easy task""","",""
"If [MSK1] is true, then [MSK2] is true. [MSK2] is true. Therefore, [MSK1] is true.","https://quizizz.com/admin/quiz/5da783b3216605001ad267df/match-logical-fallacies","false analogy","We shouldn't let teenagers keep their phones just because they're upset at losing them; most babies cry when you take their toys away too.","",""
"If [MSK1] is true, then [MSK2] is true. [MSK2] is true. Therefore, [MSK1] is true.","https://quizizz.com/admin/quiz/5fc513ccc22a8c001b2c995b/logical-fallacies-more","false analogy","Santa has a red suit. My dad has a red suit. My dad must be Santa Claus!","",""
"If [MSK1] is true, then [MSK2] is true. [MSK2] is true. Therefore, [MSK1] is true.","https://quizizz.com/admin/quiz/5f589da2cf5b97001b513da7/logical-fallacies-practice","false analogy","The book ""Investing for Dummies"" really helped me understand my finances better. The book ""Chess for Dummies"" was written by the same author, was published by the same press, and costs about the same amount, so it would probably help me understand my finances as well.","",""
"If [MSK1] is true, then [MSK2] is true. [MSK2] is true. Therefore, [MSK1] is true.","https://quizizz.com/admin/quiz/5f94b60e682994001daa62b4/logical-fallacies","false analogy","It is ridiculous to have spent thousands of dollars to rescue those two whales trapped in the Arctic ice. Why, look at all the people trapped in jobs they don’t like.","",""
