"updated_label","original_url","old_label","source_article","explanations","rationale"
"Either [MSK1] or [MSK2] is true.","https://valenciacollege.edu/students/learning-support/winter-park/communications/documents/LogicalFallaciesCSSCTipSheet_Revised_.pdf","false dilemma","Love America or leave it.","",""
"Either [MSK1] or [MSK2] is true.","https://quizizz.com/admin/quiz/608aa4ecb8575b001cc6ef62/logical-fallacies","false dilemma","We cannot support immigrants because we have too many homeless and poor Americans.","",""
"Either [MSK1] or [MSK2] is true.","https://quizizz.com/admin/quiz/5f886ce55bec10001beda125/logical-fallacy-practice","false dilemma","Either you decide that you can afford this stereo, or decide not to have music for a while","",""
"Either [MSK1] or [MSK2] is true.","https://courses.lumenlearning.com/englishcomp1/chapter/common-logical-fallacies/","false dilemma","If you are not with us, you are against us.","",""
"Either [MSK1] or [MSK2] is true.","https://courses.lumenlearning.com/englishcomp1/chapter/common-logical-fallacies/","false dilemma","Either we pass this ordinance or there will be rioting in the streets.","",""
"Either [MSK1] or [MSK2] is true.","https://quizizz.com/admin/quiz/601186198d64cb001b52da5f/logical-fallacies","false dilemma","Too much candy can cause cavities. You should avoid eating any candy unless you want cavities.","",""
"Either [MSK1] or [MSK2] is true.","https://quizizz.com/admin/quiz/601186198d64cb001b52da5f/logical-fallacies","false dilemma","Either you can save your money to buy a new car for yourself, or you can just take an Uber around for the rest of your life.","",""
"Either [MSK1] or [MSK2] is true.","https://quizizz.com/admin/quiz/601186198d64cb001b52da5f/logical-fallacies","false dilemma","Either you text your friend or you don't have any fun at all.","",""
"Either [MSK1] or [MSK2] is true.","https://quizizz.com/admin/quiz/611c926f727f7f001f8dea1c/common-fallacies","false dilemma","""The only solutions I can see to climate change is either mass extinction of humans, or passing this green bill.""","",""
"Either [MSK1] or [MSK2] is true.","https://quizizz.com/admin/quiz/5821269bd6a87cd126903137/logical-fallacies","false dilemma","Either you love bacon, or you're wrong.","",""
"Either [MSK1] or [MSK2] is true.","https://quizizz.com/admin/quiz/5fb29e126d2ec0001d4a5017/logical-fallacies","false dilemma","If you drive without car insurance, then you’re an accident waiting to happen. Stay protected with Auto Union insurance.","",""
"Either [MSK1] or [MSK2] is true.","https://quizizz.com/admin/quiz/5fad853bb9adc4001b1fa5c9/logical-fallacies","false dilemma","Student: You didn't teach us this; we never learned this. Teacher: So, you're either lazy or unwilling to learn is that right?","",""
"Either [MSK1] or [MSK2] is true.","https://quizizz.com/admin/quiz/5ea5b334b4da62001c0f27bf/logical-fallacies","false dilemma","I'm raising funds to help cure XYZ disease. If you don't donate, then you're part of the problem.","",""
"Either [MSK1] or [MSK2] is true.","https://quizizz.com/admin/quiz/5df18450e0d780001ef69064/logical-fallacies-set","false dilemma","People either like coffee or hate it.","",""
"Either [MSK1] or [MSK2] is true.","https://quizizz.com/admin/quiz/60871eab7d7eb8001bf0d82a/logical-fallacies","false dilemma","Subscribe to our streaming services, or get stuck with cable!","",""
"Either [MSK1] or [MSK2] is true.","https://quizizz.com/admin/quiz/601d4f7f893cd7001c42d2a7/logical-fallacies","false dilemma","Sukaina to her mom: Either you buy me this new book, or you decide that reading is not important at all.","",""
"Either [MSK1] or [MSK2] is true.","https://quizizz.com/admin/quiz/601d4f7f893cd7001c42d2a7/logical-fallacies","false dilemma","""Either you pass this test, or you fail it."" Laughed Sr Malak","",""
"Either [MSK1] or [MSK2] is true.","https://quizizz.com/admin/quiz/5c5de6561764fb001aa78ff2/logical-fallacies","false dilemma","If you don't say the Pledge of Allegiance, you must be a traitor.","",""
"Either [MSK1] or [MSK2] is true.","https://quizizz.com/admin/quiz/5aa8942d5ae5a90019188726/fallacies","false dilemma","You can buy the new Sensitivity perfume, or you can smell bad all day.","",""
"Either [MSK1] or [MSK2] is true.","https://quizizz.com/admin/quiz/60a683b792ce65001b5816bf/logical-fallacies","false dilemma","Vote for me or live through four more years of higher taxes.","",""
"Either [MSK1] or [MSK2] is true.","https://quizizz.com/admin/quiz/60242064a66179001be30a7b/logical-fallacies","false dilemma","We either have to cut taxes or leave a huge debt for our children.","",""
"Either [MSK1] or [MSK2] is true.","https://quizizz.com/admin/quiz/5e567bd2b92c06001b7421e0/logical-fallacies","false dilemma","The museum's new gemstones and precious minerals exhibit needs more security guards. If you don't agree, then you must be planning to steal a piece of the exhibit","",""
"Either [MSK1] or [MSK2] is true.","https://quizizz.com/admin/quiz/5e567bd2b92c06001b7421e0/logical-fallacies","false dilemma","Presents only two choices when more options exist","",""
"[MSK1] has attribute [MSK2]. [MSK1] is a subset of [MSK3]. Therefore, all [MSK3] has attribute [MSK2].","https://quizizz.com/admin/quiz/6013f8a0f50efb001ba7d0b4/logical-fallacies","slippery slope","""You can never give anyone a break. If you do, they'll walk all over you.""","",""
"[MSK1] has attribute [MSK2]. [MSK1] is a subset of [MSK3]. Therefore, all [MSK3] has attribute [MSK2].","https://quizizz.com/admin/quiz/5d8b58e02e4e1c001a5023ab/fallacies","slippery slope","Don't let your cousin borrow $10.00. Next, he's going to be borrowing money from you every day.","",""
"[MSK1] has attribute [MSK2]. [MSK1] is a subset of [MSK3]. Therefore, all [MSK3] has attribute [MSK2].","https://quizizz.com/admin/quiz/5fa94745abef66001b5aeb64/fallacy-quiz","slippery slope","If we let our child out of his room, eventually he will want to leave the house, and will end up on the street. If he is walking around on the street then he will be snatched up by a stranger and sold into slavery in a remote region on the World.","",""
"[MSK1] has attribute [MSK2]. [MSK1] is a subset of [MSK3]. Therefore, all [MSK3] has attribute [MSK2].","https://quizizz.com/admin/quiz/5e97bbd812a258001ba32871/fallacies","slippery slope","Animal experimentation reduces our respect for life. If we don't respect life, we are likely to be more and more tolerant of violent acts like war and murder. Soon our society will become a battlefield in which everyone constantly fears for their lives. It will be the end of civilization.","",""
"[MSK1] has attribute [MSK2]. [MSK1] is a subset of [MSK3]. Therefore, all [MSK3] has attribute [MSK2].","https://quizizz.com/admin/quiz/5fab3cc677f31f001e81b694/appeals-and-fallacies-quiz","slippery slope","If we control Covid-19 with measures that are too draconian, we could wind up with a government that regularly clamps down on its citizens, with bar codes on wrists and cameras in your houses that watch you all the time.","",""
"[MSK1] has attribute [MSK2]. [MSK1] is a subset of [MSK3]. Therefore, all [MSK3] has attribute [MSK2].","https://www.pesec.no/24-most-common-logical-fallacies/","slippery slope","Colin Closet asserts that if we allow same-sex couples to marry, then the next thing we know we'll be allowing people to marry their parents, their cars and even monkeys.","",""
"[MSK1] has attribute [MSK2]. [MSK1] is a subset of [MSK3]. Therefore, all [MSK3] has attribute [MSK2].","https://quizizz.com/admin/quiz/5a0f0600920b9b1100fb5669/logical-fallacy","slippery slope","If we allow euthanasia, the next thing you know, murder will be legal.","",""
"[MSK1] has attribute [MSK2]. [MSK1] is a subset of [MSK3]. Therefore, all [MSK3] has attribute [MSK2].","https://quizizz.com/admin/quiz/5dd1e2da4b69e5001bff3e97/emotional-fallacies","slippery slope","If you don't go to camp, you won't have fun this summer, and your whole summer will be ruined!","",""
"[MSK1] has attribute [MSK2]. [MSK1] is a subset of [MSK3]. Therefore, all [MSK3] has attribute [MSK2].","https://quizizz.com/admin/quiz/5e66ec8210bf64001b1fa963/logical-fallacies","slippery slope","If you forget to floss, you will get cavities, and if you get cavities, you will lose all your teeth by the time you're 30.","",""
"[MSK1] has attribute [MSK2]. [MSK1] is a subset of [MSK3]. Therefore, all [MSK3] has attribute [MSK2].","https://quizizz.com/admin/quiz/5955a3f0181ab41000ac5a83/debate-fallacies","slippery slope","Justin claimed that passing federal laws to control the amount of violence in music is the first step in a process that will eventually result in absolute government control of the media and total censorship over all forms of artistic expression.","",""
"[MSK1] has attribute [MSK2]. [MSK1] is a subset of [MSK3]. Therefore, all [MSK3] has attribute [MSK2].","https://quizizz.com/admin/quiz/5955a3f0181ab41000ac5a83/debate-fallacies","slippery slope","Lindsay's mom is concerned when she finds out that Lindsay skipped class one day. She tells Lindsay that she will now start skipping more frequently. Then she will drop out altogether, never graduate or get into college, and end up unemployed and living at home for the rest of her life.","",""
"[MSK1] has attribute [MSK2]. [MSK1] is a subset of [MSK3]. Therefore, all [MSK3] has attribute [MSK2].","https://quizizz.com/admin/quiz/5821269bd6a87cd126903137/logical-fallacies","slippery slope","Don't ever gamble! Once you start, you won't be able to stop, and you'll end up bankrupt.","",""
"[MSK1] has attribute [MSK2]. [MSK1] is a subset of [MSK3]. Therefore, all [MSK3] has attribute [MSK2].","https://quizizz.com/admin/quiz/5dcb28944bb29b001f3c5e53/logical-fallacies-false-logic","slippery slope","If we get rid of assault weapons for citizens then we will also soon lose freedom of speech and all freedoms as other countries rush in to conquer us (if the zombies don’t exterminate us first!)","",""
"[MSK1] has attribute [MSK2]. [MSK1] is a subset of [MSK3]. Therefore, all [MSK3] has attribute [MSK2].","https://quizizz.com/admin/quiz/5dcb28944bb29b001f3c5e53/logical-fallacies-false-logic","slippery slope","one thing leads to another and another and another. . . creates a “snowball” effect.","",""
"[MSK1] has attribute [MSK2]. [MSK1] is a subset of [MSK3]. Therefore, all [MSK3] has attribute [MSK2].","https://quizizz.com/admin/quiz/5f1a97984ffed6001b997086/logical-fallacies","slippery slope","If you're going to add that much salt to the soup, you might as well pour the whole box in!","",""
"[MSK1] has attribute [MSK2]. [MSK1] is a subset of [MSK3]. Therefore, all [MSK3] has attribute [MSK2].","https://quizizz.com/admin/quiz/5f1a97984ffed6001b997086/logical-fallacies","slippery slope","If we let the government implant tracking devices in criminals, it's not going to stop there! They're going to want to track school children and eventually everyone!","",""
"[MSK1] has attribute [MSK2]. [MSK1] is a subset of [MSK3]. Therefore, all [MSK3] has attribute [MSK2].","https://quizizz.com/admin/quiz/606ff0f48e5148001c3e4891/elt-fallacies-in-writing-nd","slippery slope","""If I raise you, I must raise everyone, and then the company goes bankrupt.""","",""
"[MSK1] has attribute [MSK2]. [MSK1] is a subset of [MSK3]. Therefore, all [MSK3] has attribute [MSK2].","https://quizizz.com/admin/quiz/5c052a53f1cae6001ab2d649/easier-logical-fallacy-review","slippery slope","If I go to the bathroom, I will miss the notes, then I'll do poorly on a test, then I won't get into college, so I won't go to the bathroom.","",""
"[MSK1] has attribute [MSK2]. [MSK1] is a subset of [MSK3]. Therefore, all [MSK3] has attribute [MSK2].","https://quizizz.com/admin/quiz/5fa314fe29f97f001b7e198f/fallacy-quiz","slippery slope","If you eat that cookie tonight, you'll eat ten tomorrow, and by this time next year, you'll be eating 1 million cookies a day.","",""
"[MSK1] has attribute [MSK2]. [MSK1] is a subset of [MSK3]. Therefore, all [MSK3] has attribute [MSK2].","https://quizizz.com/admin/quiz/5a299094876fa01100a5d10b/logical-fallacy-review","slippery slope","Don't ever steal! Once you start, you won't be able to stop, and you'll end up bankrupt.","",""
"[MSK1] has attribute [MSK2]. [MSK1] is a subset of [MSK3]. Therefore, all [MSK3] has attribute [MSK2].","https://quizizz.com/admin/quiz/5e455f8951693e001c452406/fallacies-of-argument-ch","slippery slope","If you don't cancel your cable, then..., then...., and you'll wake up in a ditch.","",""
"[MSK1] has attribute [MSK2]. [MSK1] is a subset of [MSK3]. Therefore, all [MSK3] has attribute [MSK2].","https://quizizz.com/admin/quiz/5db978973e3b40001ac3ffe3/persuasive-techniques-practice","slippery slope","If you vote for her, the government as we know it will fall apart.","",""
"[MSK1] has attribute [MSK2]. [MSK1] is a subset of [MSK3]. Therefore, all [MSK3] has attribute [MSK2].","https://quizizz.com/admin/quiz/5e418ae90e0c7d001b8749e9/logical-fallacy","slippery slope","If we allow a housing development to be built on Sunny Lake, a resort will come next, and soon we won’t have any wilderness left!","",""
"[MSK1] has attribute [MSK2]. [MSK1] is a subset of [MSK3]. Therefore, all [MSK3] has attribute [MSK2].","https://quizizz.com/admin/quiz/5d90f216d258e4001a11c33c/fun-with-fallacies","slippery slope","""If you don't bring a pencil to class... you will end up sad and alone in life.""","",""
"[MSK1] has attribute [MSK2]. [MSK1] is a subset of [MSK3]. Therefore, all [MSK3] has attribute [MSK2].","https://quizizz.com/admin/quiz/60804bf832accb001ba2444f/logical-fallacies","slippery slope","“If America doesn’t send weapons to the Syrian rebels, they won’t be able to defend themselves against their warring dictator. They’ll lose their civil war, and that dictator will oppress them, and the Soviets will consequently carve out a sphere of influence that spreads across the entire Middle East.","",""
"[MSK1] has attribute [MSK2]. [MSK1] is a subset of [MSK3]. Therefore, all [MSK3] has attribute [MSK2].","https://quizizz.com/admin/quiz/60a683b792ce65001b5816bf/logical-fallacies","slippery slope","Everyone loves Rebecca, because she is so popular.","",""
"[MSK1] has attribute [MSK2]. [MSK1] is a subset of [MSK3]. Therefore, all [MSK3] has attribute [MSK2].","https://quizizz.com/admin/quiz/60a683b792ce65001b5816bf/logical-fallacies","slippery slope","Today late for ten minutes, tomorrow late for an hour, and then someday you will simply cease to show up.","",""
"[MSK1] has attribute [MSK2]. [MSK1] is a subset of [MSK3]. Therefore, all [MSK3] has attribute [MSK2].","https://quizizz.com/admin/quiz/608aa4ecb8575b001cc6ef62/logical-fallacies","slippery slope","My mother always told me that if I went outside right after bathing, during winter, I would catch pneumonia.","",""
"[MSK1] has attribute [MSK2]. [MSK1] is a subset of [MSK3]. Therefore, all [MSK3] has attribute [MSK2].","https://quizizz.com/admin/quiz/60242064a66179001be30a7b/logical-fallacies","slippery slope","If you don’t expose your child to germs, he will never get sick. Therefore, he will never build up his immune system to fight illness. He will grow up to be a sickly adult.","",""
"[MSK1] has attribute [MSK2]. [MSK1] is a subset of [MSK3]. Therefore, all [MSK3] has attribute [MSK2].","https://quizizz.com/admin/quiz/601d4f7f893cd7001c42d2a7/logical-fallacies","slippery slope","If you don't pass this quiz, you will get a low grade. This will affect your score in the gradebook, you will fail Eng II. You will not graduate Highschool. You will not get a good job.","",""
"[MSK1] has attribute [MSK2]. [MSK1] is a subset of [MSK3]. Therefore, all [MSK3] has attribute [MSK2].","https://quizizz.com/admin/quiz/601d4f7f893cd7001c42d2a7/logical-fallacies","slippery slope","If we allow our 14 year-old to have her first date tonight, what's next? A wedding, kids?","",""
"[MSK1] has attribute [MSK2]. [MSK1] is a subset of [MSK3]. Therefore, all [MSK3] has attribute [MSK2].","https://quizizz.com/admin/quiz/601d4f7f893cd7001c42d2a7/logical-fallacies","slippery slope","""We've got to stop them from banning poetry. Once they start banning one form of literature, they will never stop. Next thing you know, they will be burning all the books!"" Ammar demanded.","",""
"[MSK1] has attribute [MSK2]. [MSK1] is a subset of [MSK3]. Therefore, all [MSK3] has attribute [MSK2].","https://quizizz.com/admin/quiz/601d4f7f893cd7001c42d2a7/logical-fallacies","slippery slope","Habib didn't remember to take out the trash this morning. It will pile up and the neighbors will complain and the health inspectors will come and take away the kids.","",""
"[MSK1] has attribute [MSK2]. [MSK1] is a subset of [MSK3]. Therefore, all [MSK3] has attribute [MSK2].","https://quizizz.com/admin/quiz/5f94b60e682994001daa62b4/logical-fallacies","slippery slope","We can’t freeze the academic year because then students won’t graduate on time. Next thing you know most people will be unemployed and will resort to crime. The crime rate will skyrocket and society will collapse.","",""
"[MSK1] has attribute [MSK2]. [MSK1] is a subset of [MSK3]. Therefore, all [MSK3] has attribute [MSK2].","https://quizizz.com/admin/quiz/5e97bbd812a258001ba32871/fallacies","slippery slope","You should never gamble. Once you start gambling you find it hard to stop. Soon you are spending all your money on gambling, and eventually you will turn to crime to support your earnings.","",""
"[MSK1] has attribute [MSK2]. [MSK1] is a subset of [MSK3]. Therefore, all [MSK3] has attribute [MSK2].","https://quizizz.com/admin/quiz/5e208950881f96001b246eab/logical-fallacies","slippery slope","We need to stop allowing colleges to increase tuition every year. The next thing we know, it's going to cost more to attend college for one semester than it is to buy a new home!","",""
"[MSK1] has attribute [MSK2]. [MSK1] is a subset of [MSK3]. Therefore, all [MSK3] has attribute [MSK2].","https://quizizz.com/admin/quiz/5dd2aca5fc8633001bc7b986/fallacy-review","slippery slope","If I don’t take this A.P. class, then I won’t do well on the exam. If I don’t do well on the A.P. exam, then I can’t get into a good college. If I can’t get into a good college, then I’ll never get a good job. If I can’t get a good job, then I’m going to have to live in my parents’ basement forever. Guess I’ll sign up for the A.P. class.","",""
"[MSK1] has attribute [MSK2]. [MSK1] is a subset of [MSK3]. Therefore, all [MSK3] has attribute [MSK2].","https://quizizz.com/admin/quiz/6013f8a0f50efb001ba7d0b4/logical-fallacies","slippery slope","Teacher: If I let you go to the bathroom pretty soon everybody will want to go to the bathroom.","",""
"[MSK1] has attribute [MSK2]. [MSK1] is a subset of [MSK3]. Therefore, all [MSK3] has attribute [MSK2].","https://quizizz.com/admin/quiz/6013f8a0f50efb001ba7d0b4/logical-fallacies","slippery slope","If we use just one more can of hairspray this month, earth as we know it will no longer exist.","",""
"[MSK1] has attribute [MSK2]. [MSK1] is a subset of [MSK3]. Therefore, all [MSK3] has attribute [MSK2].","https://www.logicallyfallacious.com/logicalfallacies/Jumping-to-Conclusions","hasty generalization","It’s getting late, and we still have to decide on the school budget. What do you say we just leave it as is and we can call it a night?","It is not reasonable to assume the conclusion that the budget should be left where it is based on the desire to go home.",""
"[MSK1] has attribute [MSK2]. [MSK1] is a subset of [MSK3]. Therefore, all [MSK3] has attribute [MSK2].","https://www.logicallyfallacious.com/logicalfallacies/Jumping-to-Conclusions","hasty generalization","Wife: Should we buy the house? Husband: The Realtor didn’t say anything about any problems, so I am sure it is fine. Let’s get it!","The husband is jumping to the conclusion that the house is without problems simply because the person who gets paid to sell the house did not mention any. This is fallacious reasoning.",""
"[MSK1] has attribute [MSK2]. [MSK1] is a subset of [MSK3]. Therefore, all [MSK3] has attribute [MSK2].","https://quizizz.com/admin/quiz/5f918a04b5be2c001b528339/logical-fallacies-quiz","slippery slope","since he skipped one class, he will start skipping more frequently. Then he will drop out altogether, never graduate or get into college, and end up unemployed and living at home for the rest of his life","",""
"[MSK1] has attribute [MSK2]. [MSK1] is a subset of [MSK3]. Therefore, all [MSK3] has attribute [MSK2].","https://quizizz.com/admin/quiz/601af49c678cb2001f54a78b/th-logical-fallacies","slippery slope","Your honor, if we let Pinocchio get away with lying, what's next? Stealing? Murder? ...","",""
"[MSK1] has attribute [MSK2]. [MSK1] is a subset of [MSK3]. Therefore, all [MSK3] has attribute [MSK2].","https://quizizz.com/admin/quiz/5fadd7513db61a001b0864b9/logical-fallacies","slippery slope","""If we ban Hummers because they are bad for the environment, then eventually the government will ban all cars; therefore, we should not ban Hummers.""","",""
"[MSK1] has attribute [MSK2]. [MSK1] is a subset of [MSK3]. Therefore, all [MSK3] has attribute [MSK2].","https://quizizz.com/admin/quiz/5da783b3216605001ad267df/match-logical-fallacies","slippery slope","If we ban cell phones because they are bad for teenagers next the government will ban all iPods and eventually all video games as well.","",""
"[MSK1] has attribute [MSK2]. [MSK1] is a subset of [MSK3]. Therefore, all [MSK3] has attribute [MSK2].","https://quizizz.com/admin/quiz/5ffdbb6b36ee14001ec3829e/fallacies","slippery slope","If we keep kids from enjoying recess, eventually they will never want to preserve nature.","",""
"[MSK1] has attribute [MSK2]. [MSK1] is a subset of [MSK3]. Therefore, all [MSK3] has attribute [MSK2].","https://quizizz.com/admin/quiz/5a0f0600920b9b1100fb5669/logical-fallacy","slippery slope","If you don't study, you'll fail your test. Then you will do poorly in the class and your GPA will fall. You won't get into a good college, so you'll never get a decent job and you'll end up homeless.","",""
"[MSK1] has attribute [MSK2]. [MSK1] is a subset of [MSK3]. Therefore, all [MSK3] has attribute [MSK2].","https://quizizz.com/admin/quiz/5fd79a1feb9b65001b6de52a/ap-q-rhetorical-fallacies","slippery slope","I failed my AP vocab test so clearly I'm going to fail the class. Then I won't get into college and will never get a job. I will have to live in my parents' basement for the rest of my life. My life is ruined","",""
"[MSK1] has attribute [MSK2]. [MSK1] is a subset of [MSK3]. Therefore, all [MSK3] has attribute [MSK2].","https://quizizz.com/admin/quiz/5e822728fb03dd001ba9419b/logical-fallacies-part-one","slippery slope","If you allow the students to redo this one test, they will always want to redo all future tests","",""
"[MSK1] has attribute [MSK2]. [MSK1] is a subset of [MSK3]. Therefore, all [MSK3] has attribute [MSK2].","https://quizizz.com/admin/quiz/5fc51524c0ffdb001b6b57ac/quiz-logical-fallacies","slippery slope","If we let your brother stay, we’ll have to let your whole family stay.","",""
"[MSK1] has attribute [MSK2]. [MSK1] is a subset of [MSK3]. Therefore, all [MSK3] has attribute [MSK2].","https://quizizz.com/admin/quiz/60b4f4000f8488001b40c84c/types-of-logical-fallacy","slippery slope","If we let this child bring the permission slip late, there is no reason to ever set a deadline for anything again!","",""
"[MSK1] has attribute [MSK2]. [MSK1] is a subset of [MSK3]. Therefore, all [MSK3] has attribute [MSK2].","https://quizizz.com/admin/quiz/5fe94858a0463a001b61cfcc/logical-fallacies","slippery slope","“If we let teenagers wear whatever they want to school, they will no longer respect the rules and academic performance will decline.”","",""
"[MSK1] has attribute [MSK2]. [MSK1] is a subset of [MSK3]. Therefore, all [MSK3] has attribute [MSK2].","https://quizizz.com/admin/quiz/5da9c616b36650001b516bbf/logical-fallacies","slippery slope","If you break your diet and have one cookie tonight, you will just want to eat 10 cookies tomorrow, and before you know it, you will have gained back the 15 pounds you lost.","",""
"[MSK1] has attribute [MSK2]. [MSK1] is a subset of [MSK3]. Therefore, all [MSK3] has attribute [MSK2].","https://quizizz.com/admin/quiz/5ea5b334b4da62001c0f27bf/logical-fallacies","slippery slope","If I don't take this Advanced Placement (A.P.) class, then I won't do well on the exam. If I don't do well on the A.P. exam, then I can't get into a good college. If I can't get into a good college, then I'll never get a good job. If I can't get a good job, then I'm going to have to live in my parents' basement forever. Guess I'll sign up for the A.P. class","",""
"[MSK1] has attribute [MSK2]. [MSK1] is a subset of [MSK3]. Therefore, all [MSK3] has attribute [MSK2].","https://quizizz.com/admin/quiz/5e32e7cf3c268f001c0dda1d/logical-fallacies","slippery slope","If I don't take the right classes in high school, then I won't be able to get into a good college. If I don't get into a good college, then I won't be able to get a job. If I can't get a job, then I am going to end up homeless.","",""
"[MSK1] has attribute [MSK2]. [MSK1] is a subset of [MSK3]. Therefore, all [MSK3] has attribute [MSK2].","https://quizizz.com/admin/quiz/6059f970a5d7c3001da9d533/logical-fallacies","slippery slope","Don't let your children stay up till midnight on New Year's Eve. Before you know it, they'll be demanding to stay up till midnight every night.","",""
"[MSK1] has attribute [MSK2]. [MSK1] is a subset of [MSK3]. Therefore, all [MSK3] has attribute [MSK2].","https://quizizz.com/admin/quiz/5c890a34b355a3001d6addb9/logical-fallacies","slippery slope","If you allow the students to redo this test, they are going to want to redo every assignment for the rest of the year.","",""
